product_name,category,description,ad_copy
Resistance Bands,Sports & Fitness,Complete set with multiple resistance levels,Experience enhance performance with Resistance Bands. Complete set with multiple resistance levels. enhance performance included. Buy today today!
Electric Kettle,Home & Kitchen,Fast boiling with auto shut-off safety,Tired of uncomfortable use? Electric Kettle is your solution! Fast boiling with auto shut-off safety. save time. Buy today!
Laptop Cooling Pad,Electronics,Dual fans to prevent overheating,"Laptop Cooling Pad: Rated 5 stars by 100,000+ users. Dual fans to prevent overheating. reduce stress. Try it now!"
Cologne,Personal Care,Long-lasting sophisticated scent,Say goodbye to poor quality. Cologne Long-lasting sophisticated scent. increase comfort. Upgrade now today!
Gaming Mouse,Electronics,Precision wireless mouse with RGB lighting,Get save money and boost productivity with our Gaming Mouse. Precision wireless mouse with RGB lighting. Start saving now!
Coffee Maker,Home & Kitchen,Programmable machine that brews perfect coffee,Say goodbye to high costs. Coffee Maker Programmable machine that brews perfect coffee. maximize results. Experience the difference today!
Electric Toothbrush,Personal Care,Sonic cleaning with smart timer,Electric Toothbrush delivers simplify life and save time. Sonic cleaning with smart timer. Perfect for travelers. Try it!
Highlighters,Office Supplies,Vibrant colors that don't bleed,Experience reduce stress with Highlighters. Vibrant colors that don't bleed. reduce stress included. Try it today!
Mixing Bowls,Home & Kitchen,Nesting set with non-slip bases,Tired of unreliable performance? Mixing Bowls is your solution! Nesting set with non-slip bases. maximize results. Start saving!
Desk Organizer,Office Supplies,Bamboo organizer with compartments,Desk Organizer delivers save money and save time. Bamboo organizer with compartments. Perfect for fitness lovers. Buy today!
Desk Organizer,Office Supplies,Bamboo organizer with compartments,Get save time and save money with our Desk Organizer. Bamboo organizer with compartments. Upgrade now now!
Pens,Office Supplies,Smooth-writing ballpoint pens,Struggling with wasted time? Our Pens changes everything. Smooth-writing ballpoint pens. Get yours!
Mixing Bowls,Home & Kitchen,Nesting set with non-slip bases,Get eliminate hassle and boost productivity with our Mixing Bowls. Nesting set with non-slip bases. Buy today now!
Knife Set,Home & Kitchen,Professional-grade stainless steel blades,Struggling with high costs? Our Knife Set changes everything. Professional-grade stainless steel blades. Get yours!
Ring Light,Electronics,Adjustable brightness for perfect lighting,Struggling with poor quality? Our Ring Light changes everything. Adjustable brightness for perfect lighting. Try it!
Bluetooth Speaker,Electronics,Portable waterproof speaker with 360-degree sound,Bluetooth Speaker includes premium quality and easy setup. Portable waterproof speaker with 360-degree sound. Don't wait now!
Wireless Charger,Electronics,Fast charging pad for all Qi-enabled devices,"Wireless Charger features premium quality, easy setup, and lifetime warranty. Fast charging pad for all Qi-enabled devices. Get yours!"
Watch,Accessories,Classic analog with leather strap,"Watch features premium quality, easy setup, and lifetime warranty. Classic analog with leather strap. Buy today!"
Wireless Earbuds,Electronics,True wireless with charging case and touch controls,"Trusted by 150,000+ customers. Wireless Earbuds True wireless with charging case and touch controls. Get yours today!"
Stainless Steel Water Bottle,Home & Kitchen,Insulated to keep drinks cold or hot all day,Experience reduce stress with Stainless Steel Water Bottle. Insulated to keep drinks cold or hot all day. increase comfort included. Make the switch today!
Electric Kettle,Home & Kitchen,Fast boiling with auto shut-off safety,Don't miss out on Electric Kettle. Fast boiling with auto shut-off safety. enhance performance. Get yours - stock is limited!
Razor,Personal Care,Multi-blade for smooth shave,Don't miss out on Razor. Multi-blade for smooth shave. enhance performance. Buy today - stock is limited!
Boxing Gloves,Sports & Fitness,Padded gloves for training,Say goodbye to poor quality. Boxing Gloves Padded gloves for training. simplify life. Upgrade now today!
Jump Rope,Sports & Fitness,Speed rope for cardio training,Say goodbye to poor quality. Jump Rope Speed rope for cardio training. reduce stress. Get yours today!
Wireless Earbuds,Electronics,True wireless with charging case and touch controls,Tired of poor quality? Wireless Earbuds is your solution! True wireless with charging case and touch controls. eliminate hassle. Shop now!
Exercise Ball,Sports & Fitness,Stability ball for core workouts,Exercise Ball includes premium quality and easy setup. Stability ball for core workouts. Don't wait now!
Sticky Notes,Office Supplies,Adhesive notes in assorted sizes,Last chance! Sticky Notes Adhesive notes in assorted sizes. eliminate hassle. Don't wait while supplies last!
Phone Gimbal,Electronics,3-axis stabilizer for smooth video recording,"Join 25,000+ happy customers! Phone Gimbal - 3-axis stabilizer for smooth video recording. save money. Don't wait!"
Umbrella,Accessories,Compact auto-open windproof,Don't miss out on Umbrella. Compact auto-open windproof. improve quality. Order now - stock is limited!
Scarf,Accessories,Soft cashmere blend,"Trusted by 150,000+ customers. Scarf Soft cashmere blend. Get yours today!"
Facial Cleanser,Personal Care,Gentle formula for all skin types,Don't miss out on Facial Cleanser. Gentle formula for all skin types. simplify life. Experience the difference - stock is limited!
Dash Cam,Electronics,HD car camera with loop recording and night vision,Dash Cam includes premium quality and easy setup. HD car camera with loop recording and night vision. Experience the difference now!
Wireless Charger,Electronics,Fast charging pad for all Qi-enabled devices,"Trusted by 10,000+ customers. Wireless Charger Fast charging pad for all Qi-enabled devices. Upgrade now today!"
Webcam HD,Electronics,1080p camera with auto-focus and built-in microphone,Tired of poor quality? Webcam HD is your solution! 1080p camera with auto-focus and built-in microphone. increase comfort. Don't wait!
Measuring Cups,Home & Kitchen,Stainless steel for accurate measurements,"Trusted by 100,000+ customers. Measuring Cups Stainless steel for accurate measurements. Don't wait today!"
Laptop Cooling Pad,Electronics,Dual fans to prevent overheating,"Trusted by 50,000+ customers. Laptop Cooling Pad Dual fans to prevent overheating. Buy today today!"
Keychain,Accessories,Multi-tool with LED light,Limited time! Get Keychain now. Multi-tool with LED light. improve quality. Try it before it's gone!
Face Masks,Personal Care,Hydrating sheet masks for spa days,Limited time! Get Face Masks now. Hydrating sheet masks for spa days. save money. Buy today before it's gone!
Socks Pack,Clothing,Comfortable cushioned athletic socks,Socks Pack includes premium quality and easy setup. Comfortable cushioned athletic socks. Start saving now!
Smart Plug,Electronics,WiFi-enabled outlet with voice control,"Packed with premium quality, easy setup, and more. Smart Plug WiFi-enabled outlet with voice control. Shop now today!"
Body Lotion,Personal Care,Nourishing formula for soft skin,Get reduce stress and save time with our Body Lotion. Nourishing formula for soft skin. Start saving now!
Scarf,Accessories,Soft cashmere blend,Don't miss out on Scarf. Soft cashmere blend. save time. Experience the difference - stock is limited!
Kettlebell,Sports & Fitness,Cast iron weight for strength training,Struggling with high costs? Our Kettlebell changes everything. Cast iron weight for strength training. Buy today!
Facial Cleanser,Personal Care,Gentle formula for all skin types,Struggling with outdated technology? Our Facial Cleanser changes everything. Gentle formula for all skin types. Experience the difference!
Jeans,Clothing,Classic fit denim that lasts,Limited time! Get Jeans now. Classic fit denim that lasts. eliminate hassle. Buy today before it's gone!
Hoodie,Clothing,Warm fleece with kangaroo pocket,Hoodie delivers reduce stress and eliminate hassle. Warm fleece with kangaroo pocket. Perfect for families. Get yours!
Exercise Ball,Sports & Fitness,Stability ball for core workouts,Exercise Ball includes premium quality and easy setup. Stability ball for core workouts. Don't wait now!
Measuring Cups,Home & Kitchen,Stainless steel for accurate measurements,"Measuring Cups: Rated 5 stars by 50,000+ users. Stainless steel for accurate measurements. eliminate hassle. Make the switch now!"
Desk Lamp,Office Supplies,LED with adjustable brightness,"Trusted by 100,000+ customers. Desk Lamp LED with adjustable brightness. Upgrade now today!"
Wireless Charger,Electronics,Fast charging pad for all Qi-enabled devices,Experience enhance performance with Wireless Charger. Fast charging pad for all Qi-enabled devices. boost productivity included. Upgrade now today!
Toaster Oven,Home & Kitchen,Compact convection oven for any task,"Packed with premium quality, easy setup, and more. Toaster Oven Compact convection oven for any task. Shop now today!"
Umbrella,Accessories,Compact auto-open windproof,Tired of high costs? Umbrella is your solution! Compact auto-open windproof. boost productivity. Upgrade now!
Can Opener,Home & Kitchen,Smooth-edge safe opener,Say goodbye to high costs. Can Opener Smooth-edge safe opener. save time. Experience the difference today!
Razor,Personal Care,Multi-blade for smooth shave,Experience simplify life with Razor. Multi-blade for smooth shave. simplify life included. Try it today!
Scarf,Accessories,Soft cashmere blend,Scarf delivers eliminate hassle and improve quality. Soft cashmere blend. Perfect for professionals. Experience the difference!
Desk Organizer,Office Supplies,Bamboo organizer with compartments,"Desk Organizer features premium quality, easy setup, and lifetime warranty. Bamboo organizer with compartments. Don't wait!"
Wireless Earbuds,Electronics,True wireless with charging case and touch controls,"Wireless Earbuds features premium quality, easy setup, and lifetime warranty. True wireless with charging case and touch controls. Start saving!"
Mouse Pad,Office Supplies,Large gaming surface,Experience enhance performance with Mouse Pad. Large gaming surface. save time included. Upgrade now today!
Knife Set,Home & Kitchen,Professional-grade stainless steel blades,Say goodbye to complicated setups. Knife Set Professional-grade stainless steel blades. improve quality. Order now today!
Smart Light Bulbs,Electronics,WiFi-enabled color-changing LED bulbs,Struggling with poor quality? Our Smart Light Bulbs changes everything. WiFi-enabled color-changing LED bulbs. Start saving!
Smart Plug,Electronics,WiFi-enabled outlet with voice control,"Smart Plug: Rated 5 stars by 50,000+ users. WiFi-enabled outlet with voice control. increase comfort. Order now now!"
Watch,Accessories,Classic analog with leather strap,Tired of wasted time? Watch is your solution! Classic analog with leather strap. improve quality. Order now!
Sunglasses,Accessories,Polarized UV400 protection,Limited time! Get Sunglasses now. Polarized UV400 protection. improve quality. Shop now before it's gone!
Tie,Accessories,Silk necktie in classic patterns,"Join 50,000+ happy customers! Tie - Silk necktie in classic patterns. improve quality. Start saving!"
Bluetooth Speaker,Electronics,Portable waterproof speaker with 360-degree sound,"Packed with premium quality, easy setup, and more. Bluetooth Speaker Portable waterproof speaker with 360-degree sound. Experience the difference today!"
Cologne,Personal Care,Long-lasting sophisticated scent,Don't miss out on Cologne. Long-lasting sophisticated scent. boost productivity. Make the switch - stock is limited!
Hoodie,Clothing,Warm fleece with kangaroo pocket,"Packed with premium quality, easy setup, and more. Hoodie Warm fleece with kangaroo pocket. Get yours today!"
Sunscreen SPF 50,Personal Care,Broad-spectrum UV protection,Sunscreen SPF 50 delivers reduce stress and eliminate hassle. Broad-spectrum UV protection. Perfect for remote workers. Don't wait!
Scarf,Accessories,Soft cashmere blend,Scarf delivers simplify life and increase comfort. Soft cashmere blend. Perfect for travelers. Shop now!
Pull-Up Bar,Sports & Fitness,Doorway-mounted bar for upper body,"Join 25,000+ happy customers! Pull-Up Bar - Doorway-mounted bar for upper body. save time. Get yours!"
Push-Up Bars,Sports & Fitness,Elevated handles for better form,Last chance! Push-Up Bars Elevated handles for better form. improve quality. Get yours while supplies last!
Binder Clips,Office Supplies,Assorted sizes for any project,Last chance! Binder Clips Assorted sizes for any project. increase comfort. Try it while supplies last!
Sticky Notes,Office Supplies,Adhesive notes in assorted sizes,Struggling with limited features? Our Sticky Notes changes everything. Adhesive notes in assorted sizes. Try it!
Coffee Maker,Home & Kitchen,Programmable machine that brews perfect coffee,Last chance! Coffee Maker Programmable machine that brews perfect coffee. save money. Don't wait while supplies last!
Phone Case,Electronics,Durable protection with wireless charging support,Struggling with high costs? Our Phone Case changes everything. Durable protection with wireless charging support. Start saving!
Binder Clips,Office Supplies,Assorted sizes for any project,Limited time! Get Binder Clips now. Assorted sizes for any project. improve quality. Shop now before it's gone!
Webcam HD,Electronics,1080p camera with auto-focus and built-in microphone,"Webcam HD features premium quality, easy setup, and lifetime warranty. 1080p camera with auto-focus and built-in microphone. Buy today!"
Resistance Bands,Sports & Fitness,Complete set with multiple resistance levels,Don't miss out on Resistance Bands. Complete set with multiple resistance levels. reduce stress. Buy today - stock is limited!
Food Storage Containers,Home & Kitchen,Air-tight BPA-free containers,"Join 25,000+ happy customers! Food Storage Containers - Air-tight BPA-free containers. boost productivity. Make the switch!"
Balance Board,Sports & Fitness,Wooden board for stability training,Balance Board includes premium quality and easy setup. Wooden board for stability training. Start saving now!
Air Fryer,Home & Kitchen,Healthier cooking with little to no oil needed,Don't miss out on Air Fryer. Healthier cooking with little to no oil needed. simplify life. Make the switch - stock is limited!
Tote Bag,Accessories,Canvas reusable shopping bag,Don't miss out on Tote Bag. Canvas reusable shopping bag. save money. Experience the difference - stock is limited!
Yoga Strap,Sports & Fitness,Improve flexibility and reach,Say goodbye to wasted time. Yoga Strap Improve flexibility and reach. boost productivity. Try it today!
Socks Pack,Clothing,Comfortable cushioned athletic socks,"Socks Pack: Rated 5 stars by 50,000+ users. Comfortable cushioned athletic socks. save time. Order now now!"
Measuring Cups,Home & Kitchen,Stainless steel for accurate measurements,"Join 100,000+ happy customers! Measuring Cups - Stainless steel for accurate measurements. maximize results. Try it!"
Belt,Accessories,Reversible genuine leather belt,"Belt: Rated 5 stars by 10,000+ users. Reversible genuine leather belt. eliminate hassle. Buy today now!"
T-Shirt,Clothing,100% organic cotton in multiple colors,Say goodbye to poor quality. T-Shirt 100% organic cotton in multiple colors. simplify life. Make the switch today!
Cable Organizer,Electronics,Keep all cables tangle-free and organized,"Cable Organizer: Rated 5 stars by 10,000+ users. Keep all cables tangle-free and organized. improve quality. Don't wait now!"
Dash Cam,Electronics,HD car camera with loop recording and night vision,"Join 50,000+ happy customers! Dash Cam - HD car camera with loop recording and night vision. save time. Order now!"
Sunscreen SPF 50,Personal Care,Broad-spectrum UV protection,Limited time! Get Sunscreen SPF 50 now. Broad-spectrum UV protection. increase comfort. Experience the difference before it's gone!
Blender,Home & Kitchen,Powerful motor for smooth smoothies and shakes,"Blender: Rated 5 stars by 50,000+ users. Powerful motor for smooth smoothies and shakes. simplify life. Start saving now!"
Binder Clips,Office Supplies,Assorted sizes for any project,Last chance! Binder Clips Assorted sizes for any project. reduce stress. Order now while supplies last!
Running Shorts,Clothing,Moisture-wicking with pockets,Experience simplify life with Running Shorts. Moisture-wicking with pockets. simplify life included. Upgrade now today!
Backpack,Accessories,Waterproof with laptop compartment,"Join 10,000+ happy customers! Backpack - Waterproof with laptop compartment. increase comfort. Make the switch!"
French Press,Home & Kitchen,Brew rich coffee in minutes,Get eliminate hassle and reduce stress with our French Press. Brew rich coffee in minutes. Experience the difference now!
Electric Kettle,Home & Kitchen,Fast boiling with auto shut-off safety,Tired of frequent breakdowns? Electric Kettle is your solution! Fast boiling with auto shut-off safety. save time. Shop now!
Lip Balm Set,Personal Care,Moisturizing balms in multiple flavors,"Lip Balm Set features premium quality, easy setup, and lifetime warranty. Moisturizing balms in multiple flavors. Try it!"
Blender,Home & Kitchen,Powerful motor for smooth smoothies and shakes,Struggling with unreliable performance? Our Blender changes everything. Powerful motor for smooth smoothies and shakes. Try it!
Hoodie,Clothing,Warm fleece with kangaroo pocket,Hoodie delivers increase comfort and save money. Warm fleece with kangaroo pocket. Perfect for professionals. Try it!
Nail Clippers,Personal Care,Precision stainless steel set,Don't miss out on Nail Clippers. Precision stainless steel set. maximize results. Don't wait - stock is limited!
Lip Balm Set,Personal Care,Moisturizing balms in multiple flavors,Tired of wasted time? Lip Balm Set is your solution! Moisturizing balms in multiple flavors. increase comfort. Don't wait!
T-Shirt,Clothing,100% organic cotton in multiple colors,Struggling with limited features? Our T-Shirt changes everything. 100% organic cotton in multiple colors. Order now!
Instant Pot,Home & Kitchen,7-in-1 pressure cooker for fast meals,Instant Pot delivers simplify life and boost productivity. 7-in-1 pressure cooker for fast meals. Perfect for home chefs. Order now!
Jacket,Clothing,Waterproof windbreaker for outdoors,"Jacket features premium quality, easy setup, and lifetime warranty. Waterproof windbreaker for outdoors. Upgrade now!"
Sunscreen SPF 50,Personal Care,Broad-spectrum UV protection,Say goodbye to complicated setups. Sunscreen SPF 50 Broad-spectrum UV protection. enhance performance. Don't wait today!
Electric Toothbrush,Personal Care,Sonic cleaning with smart timer,Electric Toothbrush delivers save money and improve quality. Sonic cleaning with smart timer. Perfect for travelers. Order now!
Tote Bag,Accessories,Canvas reusable shopping bag,Get boost productivity and eliminate hassle with our Tote Bag. Canvas reusable shopping bag. Experience the difference now!
French Press,Home & Kitchen,Brew rich coffee in minutes,French Press delivers improve quality and improve quality. Brew rich coffee in minutes. Perfect for home chefs. Start saving!
Dumb bells,Sports & Fitness,Adjustable weights for home workouts,"Dumb bells: Rated 5 stars by 100,000+ users. Adjustable weights for home workouts. boost productivity. Try it now!"
Shampoo,Personal Care,Sulfate-free for healthy hair,"Join 10,000+ happy customers! Shampoo - Sulfate-free for healthy hair. increase comfort. Order now!"
Pens,Office Supplies,Smooth-writing ballpoint pens,Struggling with poor quality? Our Pens changes everything. Smooth-writing ballpoint pens. Start saving!
Tweezers,Personal Care,Slant-tip for perfect plucking,Tweezers includes premium quality and easy setup. Slant-tip for perfect plucking. Start saving now!
Push-Up Bars,Sports & Fitness,Elevated handles for better form,Get boost productivity and simplify life with our Push-Up Bars. Elevated handles for better form. Try it now!
Yoga Blocks,Sports & Fitness,Supportive props for proper alignment,"Yoga Blocks features premium quality, easy setup, and lifetime warranty. Supportive props for proper alignment. Shop now!"
Exercise Ball,Sports & Fitness,Stability ball for core workouts,Last chance! Exercise Ball Stability ball for core workouts. increase comfort. Make the switch while supplies last!
File Folders,Office Supplies,Durable manila folders,Limited time! Get File Folders now. Durable manila folders. reduce stress. Experience the difference before it's gone!
French Press,Home & Kitchen,Brew rich coffee in minutes,Get eliminate hassle and increase comfort with our French Press. Brew rich coffee in minutes. Get yours now!
Webcam HD,Electronics,1080p camera with auto-focus and built-in microphone,"Packed with premium quality, easy setup, and more. Webcam HD 1080p camera with auto-focus and built-in microphone. Experience the difference today!"
Cable Organizer,Electronics,Keep all cables tangle-free and organized,Struggling with limited features? Our Cable Organizer changes everything. Keep all cables tangle-free and organized. Try it!
Tea Infuser,Home & Kitchen,Stainless mesh for loose leaf tea,Get reduce stress and save time with our Tea Infuser. Stainless mesh for loose leaf tea. Start saving now!
Razor,Personal Care,Multi-blade for smooth shave,Experience reduce stress with Razor. Multi-blade for smooth shave. enhance performance included. Shop now today!
Belt,Accessories,Reversible genuine leather belt,Tired of unreliable performance? Belt is your solution! Reversible genuine leather belt. increase comfort. Get yours!
Conditioner,Personal Care,Deep conditioning treatment,"Join 10,000+ happy customers! Conditioner - Deep conditioning treatment. eliminate hassle. Buy today!"
Jump Rope,Sports & Fitness,Speed rope for cardio training,Struggling with high costs? Our Jump Rope changes everything. Speed rope for cardio training. Make the switch!
Phone Case,Electronics,Durable protection with wireless charging support,Limited time! Get Phone Case now. Durable protection with wireless charging support. simplify life. Start saving before it's gone!
Kitchen Scale,Home & Kitchen,Digital precision for perfect recipes,"Packed with premium quality, easy setup, and more. Kitchen Scale Digital precision for perfect recipes. Upgrade now today!"
Body Lotion,Personal Care,Nourishing formula for soft skin,Struggling with outdated technology? Our Body Lotion changes everything. Nourishing formula for soft skin. Try it!
Body Lotion,Personal Care,Nourishing formula for soft skin,Don't miss out on Body Lotion. Nourishing formula for soft skin. simplify life. Order now - stock is limited!
Cable Organizer,Electronics,Keep all cables tangle-free and organized,"Join 150,000+ happy customers! Cable Organizer - Keep all cables tangle-free and organized. save money. Get yours!"
Resistance Bands,Sports & Fitness,Complete set with multiple resistance levels,Last chance! Resistance Bands Complete set with multiple resistance levels. eliminate hassle. Get yours while supplies last!
Wine Opener,Home & Kitchen,Electric corkscrew for effortless opening,"Trusted by 150,000+ customers. Wine Opener Electric corkscrew for effortless opening. Get yours today!"
Cable Organizer,Electronics,Keep all cables tangle-free and organized,Struggling with unreliable performance? Our Cable Organizer changes everything. Keep all cables tangle-free and organized. Start saving!
Dumb bells,Sports & Fitness,Adjustable weights for home workouts,Say goodbye to frequent breakdowns. Dumb bells Adjustable weights for home workouts. save time. Start saving today!
Power Bank,Electronics,High-capacity portable charger with fast charging,Tired of uncomfortable use? Power Bank is your solution! High-capacity portable charger with fast charging. eliminate hassle. Get yours!
Dumb bells,Sports & Fitness,Adjustable weights for home workouts,"Dumb bells features premium quality, easy setup, and lifetime warranty. Adjustable weights for home workouts. Try it!"
Moisturizer,Personal Care,Hydrating cream with SPF protection,"Moisturizer features premium quality, easy setup, and lifetime warranty. Hydrating cream with SPF protection. Order now!"
Air Fryer,Home & Kitchen,Healthier cooking with little to no oil needed,Say goodbye to complicated setups. Air Fryer Healthier cooking with little to no oil needed. improve quality. Don't wait today!
Wireless Charger,Electronics,Fast charging pad for all Qi-enabled devices,Struggling with outdated technology? Our Wireless Charger changes everything. Fast charging pad for all Qi-enabled devices. Upgrade now!
Smart Watch,Wearables,Fitness tracking with heart rate monitor and GPS,Tired of poor quality? Smart Watch is your solution! Fitness tracking with heart rate monitor and GPS. boost productivity. Make the switch!
USB-C Hub,Electronics,Multi-port adapter with HDMI and USB 3.0,"USB-C Hub features premium quality, easy setup, and lifetime warranty. Multi-port adapter with HDMI and USB 3.0. Start saving!"
Gaming Mouse,Electronics,Precision wireless mouse with RGB lighting,"Trusted by 50,000+ customers. Gaming Mouse Precision wireless mouse with RGB lighting. Shop now today!"
Tank Top,Clothing,Breathable fabric for workouts,Get simplify life and maximize results with our Tank Top. Breathable fabric for workouts. Order now now!
Exercise Ball,Sports & Fitness,Stability ball for core workouts,Get save time and reduce stress with our Exercise Ball. Stability ball for core workouts. Upgrade now now!
