product_name,category,description,ad_copy
Wireless Headphones,Electronics,Premium sound with noise cancellation and long battery,Wireless Headphones includes premium quality and easy setup. Premium sound with noise cancellation and long battery. Buy today now!
Wallet,Accessories,Slim bifold genuine leather,Don't miss out on Wallet. Slim bifold genuine leather. improve quality. Experience the difference - stock is limited!
Slow Cooker,Home & Kitchen,Set-and-forget cooking for busy families,"Packed with premium quality, easy setup, and more. Slow Cooker Set-and-forget cooking for busy families. Upgrade now today!"
Hoodie,Clothing,Warm fleece with kangaroo pocket,Don't miss out on Hoodie. Warm fleece with kangaroo pocket. reduce stress. Experience the difference - stock is limited!
Trash Bags,Home & Kitchen,Heavy-duty leak-proof bags,Struggling with outdated technology? Our Trash Bags changes everything. Heavy-duty leak-proof bags. Don't wait!
Hat,Clothing,Adjustable baseball cap,"Packed with premium quality, easy setup, and more. Hat Adjustable baseball cap. Order now today!"
Face Masks,Personal Care,Hydrating sheet masks for spa days,"Join 10,000+ happy customers! Face Masks - Hydrating sheet masks for spa days. boost productivity. Make the switch!"
Cable Organizer,Electronics,Keep all cables tangle-free and organized,Cable Organizer includes premium quality and easy setup. Keep all cables tangle-free and organized. Upgrade now now!
Yoga Blocks,Sports & Fitness,Supportive props for proper alignment,Limited time! Get Yoga Blocks now. Supportive props for proper alignment. increase comfort. Buy today before it's gone!
Sticky Notes,Office Supplies,Adhesive notes in assorted sizes,Sticky Notes delivers eliminate hassle and save time. Adhesive notes in assorted sizes. Perfect for busy parents. Make the switch!
Ring Light,Electronics,Adjustable brightness for perfect lighting,"Ring Light features premium quality, easy setup, and lifetime warranty. Adjustable brightness for perfect lighting. Don't wait!"
Kettlebell,Sports & Fitness,Cast iron weight for strength training,Last chance! Kettlebell Cast iron weight for strength training. save money. Try it while supplies last!
Stainless Steel Water Bottle,Home & Kitchen,Insulated to keep drinks cold or hot all day,"Join 25,000+ happy customers! Stainless Steel Water Bottle - Insulated to keep drinks cold or hot all day. boost productivity. Experience the difference!"
Smart Light Bulbs,Electronics,WiFi-enabled color-changing LED bulbs,"Trusted by 25,000+ customers. Smart Light Bulbs WiFi-enabled color-changing LED bulbs. Experience the difference today!"
Watch,Accessories,Classic analog with leather strap,Don't miss out on Watch. Classic analog with leather strap. maximize results. Don't wait - stock is limited!
Spice Rack,Home & Kitchen,Organize all spices with rotating stand,Struggling with limited features? Our Spice Rack changes everything. Organize all spices with rotating stand. Don't wait!
Wireless Headphones,Electronics,Premium sound with noise cancellation and long battery,"Trusted by 10,000+ customers. Wireless Headphones Premium sound with noise cancellation and long battery. Shop now today!"
Hat,Clothing,Adjustable baseball cap,Say goodbye to limited features. Hat Adjustable baseball cap. improve quality. Upgrade now today!
Food Storage Containers,Home & Kitchen,Air-tight BPA-free containers,Get maximize results and maximize results with our Food Storage Containers. Air-tight BPA-free containers. Start saving now!
Moisturizer,Personal Care,Hydrating cream with SPF protection,Moisturizer delivers enhance performance and increase comfort. Hydrating cream with SPF protection. Perfect for gamers. Get yours!
Desk Lamp,Office Supplies,LED with adjustable brightness,"Trusted by 25,000+ customers. Desk Lamp LED with adjustable brightness. Upgrade now today!"
Pens,Office Supplies,Smooth-writing ballpoint pens,"Join 150,000+ happy customers! Pens - Smooth-writing ballpoint pens. enhance performance. Experience the difference!"
Binder Clips,Office Supplies,Assorted sizes for any project,Binder Clips includes premium quality and easy setup. Assorted sizes for any project. Try it now!
Screen Protector,Electronics,Tempered glass protection for phones,Experience enhance performance with Screen Protector. Tempered glass protection for phones. boost productivity included. Experience the difference today!
Trash Bags,Home & Kitchen,Heavy-duty leak-proof bags,Trash Bags includes premium quality and easy setup. Heavy-duty leak-proof bags. Don't wait now!
Electric Toothbrush,Personal Care,Sonic cleaning with smart timer,Say goodbye to frequent breakdowns. Electric Toothbrush Sonic cleaning with smart timer. maximize results. Experience the difference today!
Wireless Headphones,Electronics,Premium sound with noise cancellation and long battery,Limited time! Get Wireless Headphones now. Premium sound with noise cancellation and long battery. boost productivity. Try it before it's gone!
Stapler,Office Supplies,Heavy-duty metal construction,"Join 50,000+ happy customers! Stapler - Heavy-duty metal construction. increase comfort. Order now!"
Ab Wheel,Sports & Fitness,Core strengthening roller,Last chance! Ab Wheel Core strengthening roller. simplify life. Don't wait while supplies last!
Gloves,Clothing,Touchscreen-compatible winter gloves,Experience maximize results with Gloves. Touchscreen-compatible winter gloves. save time included. Upgrade now today!
Desk Lamp,Office Supplies,LED with adjustable brightness,"Packed with premium quality, easy setup, and more. Desk Lamp LED with adjustable brightness. Shop now today!"
Tote Bag,Accessories,Canvas reusable shopping bag,Limited time! Get Tote Bag now. Canvas reusable shopping bag. boost productivity. Try it before it's gone!
Scarf,Accessories,Soft cashmere blend,Scarf delivers improve quality and reduce stress. Soft cashmere blend. Perfect for tech enthusiasts. Experience the difference!
File Folders,Office Supplies,Durable manila folders,Don't miss out on File Folders. Durable manila folders. save money. Make the switch - stock is limited!
Slow Cooker,Home & Kitchen,Set-and-forget cooking for busy families,"Trusted by 150,000+ customers. Slow Cooker Set-and-forget cooking for busy families. Try it today!"
Binder Clips,Office Supplies,Assorted sizes for any project,Tired of limited features? Binder Clips is your solution! Assorted sizes for any project. boost productivity. Start saving!
Hair Dryer,Personal Care,Ionic technology for shinier hair,"Trusted by 100,000+ customers. Hair Dryer Ionic technology for shinier hair. Order now today!"
Cable Organizer,Electronics,Keep all cables tangle-free and organized,"Cable Organizer features premium quality, easy setup, and lifetime warranty. Keep all cables tangle-free and organized. Make the switch!"
Notebook,Office Supplies,Hardcover journal with lined pages,"Notebook features premium quality, easy setup, and lifetime warranty. Hardcover journal with lined pages. Don't wait!"
Highlighters,Office Supplies,Vibrant colors that don't bleed,"Highlighters: Rated 5 stars by 25,000+ users. Vibrant colors that don't bleed. enhance performance. Start saving now!"
Desk Lamp,Office Supplies,LED with adjustable brightness,"Join 50,000+ happy customers! Desk Lamp - LED with adjustable brightness. boost productivity. Try it!"
Power Bank,Electronics,High-capacity portable charger with fast charging,Last chance! Power Bank High-capacity portable charger with fast charging. simplify life. Upgrade now while supplies last!
Sticky Notes,Office Supplies,Adhesive notes in assorted sizes,Struggling with frequent breakdowns? Our Sticky Notes changes everything. Adhesive notes in assorted sizes. Upgrade now!
Socks Pack,Clothing,Comfortable cushioned athletic socks,Don't miss out on Socks Pack. Comfortable cushioned athletic socks. eliminate hassle. Start saving - stock is limited!
Lip Balm Set,Personal Care,Moisturizing balms in multiple flavors,Limited time! Get Lip Balm Set now. Moisturizing balms in multiple flavors. save time. Try it before it's gone!
Phone Gimbal,Electronics,3-axis stabilizer for smooth video recording,"Trusted by 25,000+ customers. Phone Gimbal 3-axis stabilizer for smooth video recording. Upgrade now today!"
Tote Bag,Accessories,Canvas reusable shopping bag,"Join 100,000+ happy customers! Tote Bag - Canvas reusable shopping bag. save time. Buy today!"
Umbrella,Accessories,Compact auto-open windproof,Struggling with complicated setups? Our Umbrella changes everything. Compact auto-open windproof. Start saving!
Yoga Blocks,Sports & Fitness,Supportive props for proper alignment,Tired of poor quality? Yoga Blocks is your solution! Supportive props for proper alignment. simplify life. Don't wait!
Conditioner,Personal Care,Deep conditioning treatment,Struggling with uncomfortable use? Our Conditioner changes everything. Deep conditioning treatment. Order now!
Body Lotion,Personal Care,Nourishing formula for soft skin,Say goodbye to outdated technology. Body Lotion Nourishing formula for soft skin. simplify life. Start saving today!
Jump Rope,Sports & Fitness,Speed rope for cardio training,"Trusted by 25,000+ customers. Jump Rope Speed rope for cardio training. Get yours today!"
Sunglasses,Accessories,Polarized UV400 protection,Say goodbye to high costs. Sunglasses Polarized UV400 protection. reduce stress. Don't wait today!
T-Shirt,Clothing,100% organic cotton in multiple colors,"Trusted by 100,000+ customers. T-Shirt 100% organic cotton in multiple colors. Shop now today!"
Phone Gimbal,Electronics,3-axis stabilizer for smooth video recording,Struggling with complicated setups? Our Phone Gimbal changes everything. 3-axis stabilizer for smooth video recording. Shop now!
Stapler,Office Supplies,Heavy-duty metal construction,Stapler includes premium quality and easy setup. Heavy-duty metal construction. Start saving now!
Moisturizer,Personal Care,Hydrating cream with SPF protection,"Join 100,000+ happy customers! Moisturizer - Hydrating cream with SPF protection. maximize results. Start saving!"
Wireless Charger,Electronics,Fast charging pad for all Qi-enabled devices,"Packed with premium quality, easy setup, and more. Wireless Charger Fast charging pad for all Qi-enabled devices. Shop now today!"
Sweatpants,Clothing,Cozy joggers for lounging,Get maximize results and maximize results with our Sweatpants. Cozy joggers for lounging. Order now now!
Hoodie,Clothing,Warm fleece with kangaroo pocket,Hoodie includes premium quality and easy setup. Warm fleece with kangaroo pocket. Get yours now!
French Press,Home & Kitchen,Brew rich coffee in minutes,Tired of wasted time? French Press is your solution! Brew rich coffee in minutes. enhance performance. Buy today!
Blender,Home & Kitchen,Powerful motor for smooth smoothies and shakes,"Blender: Rated 5 stars by 100,000+ users. Powerful motor for smooth smoothies and shakes. eliminate hassle. Start saving now!"
Moisturizer,Personal Care,Hydrating cream with SPF protection,Struggling with uncomfortable use? Our Moisturizer changes everything. Hydrating cream with SPF protection. Shop now!
Ab Wheel,Sports & Fitness,Core strengthening roller,Experience simplify life with Ab Wheel. Core strengthening roller. save money included. Start saving today!
Tote Bag,Accessories,Canvas reusable shopping bag,Don't miss out on Tote Bag. Canvas reusable shopping bag. reduce stress. Make the switch - stock is limited!
Ring Light,Electronics,Adjustable brightness for perfect lighting,Experience save time with Ring Light. Adjustable brightness for perfect lighting. maximize results included. Experience the difference today!
Body Lotion,Personal Care,Nourishing formula for soft skin,Experience maximize results with Body Lotion. Nourishing formula for soft skin. boost productivity included. Order now today!
Exercise Ball,Sports & Fitness,Stability ball for core workouts,"Trusted by 150,000+ customers. Exercise Ball Stability ball for core workouts. Don't wait today!"
Highlighters,Office Supplies,Vibrant colors that don't bleed,Last chance! Highlighters Vibrant colors that don't bleed. eliminate hassle. Order now while supplies last!
Sticky Notes,Office Supplies,Adhesive notes in assorted sizes,"Sticky Notes: Rated 5 stars by 100,000+ users. Adhesive notes in assorted sizes. maximize results. Order now now!"
Measuring Cups,Home & Kitchen,Stainless steel for accurate measurements,"Trusted by 10,000+ customers. Measuring Cups Stainless steel for accurate measurements. Shop now today!"
Body Lotion,Personal Care,Nourishing formula for soft skin,Get maximize results and save time with our Body Lotion. Nourishing formula for soft skin. Experience the difference now!
Laptop Cooling Pad,Electronics,Dual fans to prevent overheating,Experience reduce stress with Laptop Cooling Pad. Dual fans to prevent overheating. improve quality included. Order now today!
French Press,Home & Kitchen,Brew rich coffee in minutes,French Press includes premium quality and easy setup. Brew rich coffee in minutes. Don't wait now!
Makeup Brushes,Personal Care,Professional quality synthetic bristles,Don't miss out on Makeup Brushes. Professional quality synthetic bristles. eliminate hassle. Get yours - stock is limited!
Yoga Strap,Sports & Fitness,Improve flexibility and reach,Say goodbye to frequent breakdowns. Yoga Strap Improve flexibility and reach. improve quality. Shop now today!
Conditioner,Personal Care,Deep conditioning treatment,Experience increase comfort with Conditioner. Deep conditioning treatment. simplify life included. Make the switch today!
Pull-Up Bar,Sports & Fitness,Doorway-mounted bar for upper body,Pull-Up Bar includes premium quality and easy setup. Doorway-mounted bar for upper body. Shop now now!
Stapler,Office Supplies,Heavy-duty metal construction,Tired of unreliable performance? Stapler is your solution! Heavy-duty metal construction. increase comfort. Shop now!
Ring Light,Electronics,Adjustable brightness for perfect lighting,"Trusted by 100,000+ customers. Ring Light Adjustable brightness for perfect lighting. Order now today!"
Toaster Oven,Home & Kitchen,Compact convection oven for any task,Tired of unreliable performance? Toaster Oven is your solution! Compact convection oven for any task. eliminate hassle. Experience the difference!
Pens,Office Supplies,Smooth-writing ballpoint pens,"Pens features premium quality, easy setup, and lifetime warranty. Smooth-writing ballpoint pens. Try it!"
Sunscreen SPF 50,Personal Care,Broad-spectrum UV protection,Sunscreen SPF 50 delivers eliminate hassle and boost productivity. Broad-spectrum UV protection. Perfect for home chefs. Order now!
Tie,Accessories,Silk necktie in classic patterns,"Tie: Rated 5 stars by 25,000+ users. Silk necktie in classic patterns. save time. Order now now!"
Kettlebell,Sports & Fitness,Cast iron weight for strength training,"Kettlebell features premium quality, easy setup, and lifetime warranty. Cast iron weight for strength training. Experience the difference!"
Dash Cam,Electronics,HD car camera with loop recording and night vision,Dash Cam includes premium quality and easy setup. HD car camera with loop recording and night vision. Order now now!
Smart Light Bulbs,Electronics,WiFi-enabled color-changing LED bulbs,"Smart Light Bulbs features premium quality, easy setup, and lifetime warranty. WiFi-enabled color-changing LED bulbs. Order now!"
Tablet Stand,Electronics,Adjustable aluminum stand for all devices,"Tablet Stand: Rated 5 stars by 50,000+ users. Adjustable aluminum stand for all devices. save time. Don't wait now!"
Tote Bag,Accessories,Canvas reusable shopping bag,Tote Bag delivers boost productivity and improve quality. Canvas reusable shopping bag. Perfect for professionals. Experience the difference!
Jump Rope,Sports & Fitness,Speed rope for cardio training,"Join 25,000+ happy customers! Jump Rope - Speed rope for cardio training. eliminate hassle. Make the switch!"
Tablet Stand,Electronics,Adjustable aluminum stand for all devices,"Packed with premium quality, easy setup, and more. Tablet Stand Adjustable aluminum stand for all devices. Upgrade now today!"
Ring Light,Electronics,Adjustable brightness for perfect lighting,Last chance! Ring Light Adjustable brightness for perfect lighting. simplify life. Shop now while supplies last!
Phone Gimbal,Electronics,3-axis stabilizer for smooth video recording,"Trusted by 50,000+ customers. Phone Gimbal 3-axis stabilizer for smooth video recording. Get yours today!"
Trash Bags,Home & Kitchen,Heavy-duty leak-proof bags,Last chance! Trash Bags Heavy-duty leak-proof bags. improve quality. Get yours while supplies last!
Smart Plug,Electronics,WiFi-enabled outlet with voice control,"Smart Plug features premium quality, easy setup, and lifetime warranty. WiFi-enabled outlet with voice control. Buy today!"
Moisturizer,Personal Care,Hydrating cream with SPF protection,Tired of complicated setups? Moisturizer is your solution! Hydrating cream with SPF protection. increase comfort. Buy today!
Wireless Earbuds,Electronics,True wireless with charging case and touch controls,"Wireless Earbuds features premium quality, easy setup, and lifetime warranty. True wireless with charging case and touch controls. Shop now!"
Backpack,Accessories,Waterproof with laptop compartment,Say goodbye to high costs. Backpack Waterproof with laptop compartment. boost productivity. Don't wait today!
Scarf,Accessories,Soft cashmere blend,Get save money and save time with our Scarf. Soft cashmere blend. Make the switch now!
Screen Protector,Electronics,Tempered glass protection for phones,Limited time! Get Screen Protector now. Tempered glass protection for phones. eliminate hassle. Make the switch before it's gone!
Yoga Mat,Sports & Fitness,Non-slip cushioned mat for all exercises,Experience maximize results with Yoga Mat. Non-slip cushioned mat for all exercises. eliminate hassle included. Don't wait today!
Blender,Home & Kitchen,Powerful motor for smooth smoothies and shakes,Struggling with poor quality? Our Blender changes everything. Powerful motor for smooth smoothies and shakes. Start saving!
Socks Pack,Clothing,Comfortable cushioned athletic socks,"Trusted by 25,000+ customers. Socks Pack Comfortable cushioned athletic socks. Don't wait today!"
Electric Toothbrush,Personal Care,Sonic cleaning with smart timer,Electric Toothbrush delivers improve quality and reduce stress. Sonic cleaning with smart timer. Perfect for home chefs. Don't wait!
Makeup Brushes,Personal Care,Professional quality synthetic bristles,Last chance! Makeup Brushes Professional quality synthetic bristles. save money. Start saving while supplies last!
Sweatpants,Clothing,Cozy joggers for lounging,Tired of high costs? Sweatpants is your solution! Cozy joggers for lounging. enhance performance. Don't wait!
Desk Lamp,Office Supplies,LED with adjustable brightness,"Join 100,000+ happy customers! Desk Lamp - LED with adjustable brightness. reduce stress. Order now!"
Sunscreen SPF 50,Personal Care,Broad-spectrum UV protection,Get save money and reduce stress with our Sunscreen SPF 50. Broad-spectrum UV protection. Upgrade now now!
Pull-Up Bar,Sports & Fitness,Doorway-mounted bar for upper body,"Pull-Up Bar: Rated 5 stars by 150,000+ users. Doorway-mounted bar for upper body. maximize results. Get yours now!"
Sunscreen SPF 50,Personal Care,Broad-spectrum UV protection,"Sunscreen SPF 50 features premium quality, easy setup, and lifetime warranty. Broad-spectrum UV protection. Upgrade now!"
Foam Roller,Sports & Fitness,Muscle recovery and massage tool,Tired of unreliable performance? Foam Roller is your solution! Muscle recovery and massage tool. maximize results. Make the switch!
Hat,Clothing,Adjustable baseball cap,Say goodbye to uncomfortable use. Hat Adjustable baseball cap. save money. Get yours today!
Dash Cam,Electronics,HD car camera with loop recording and night vision,"Dash Cam features premium quality, easy setup, and lifetime warranty. HD car camera with loop recording and night vision. Don't wait!"
Tablet Stand,Electronics,Adjustable aluminum stand for all devices,"Tablet Stand features premium quality, easy setup, and lifetime warranty. Adjustable aluminum stand for all devices. Experience the difference!"
Hair Dryer,Personal Care,Ionic technology for shinier hair,"Hair Dryer: Rated 5 stars by 100,000+ users. Ionic technology for shinier hair. eliminate hassle. Get yours now!"
Sunglasses,Accessories,Polarized UV400 protection,Struggling with poor quality? Our Sunglasses changes everything. Polarized UV400 protection. Experience the difference!
Nail Clippers,Personal Care,Precision stainless steel set,Say goodbye to wasted time. Nail Clippers Precision stainless steel set. save money. Get yours today!
Measuring Cups,Home & Kitchen,Stainless steel for accurate measurements,Measuring Cups delivers simplify life and eliminate hassle. Stainless steel for accurate measurements. Perfect for busy parents. Make the switch!
Gaming Mouse,Electronics,Precision wireless mouse with RGB lighting,"Gaming Mouse features premium quality, easy setup, and lifetime warranty. Precision wireless mouse with RGB lighting. Don't wait!"
Highlighters,Office Supplies,Vibrant colors that don't bleed,Limited time! Get Highlighters now. Vibrant colors that don't bleed. save money. Experience the difference before it's gone!
Ring Light,Electronics,Adjustable brightness for perfect lighting,Don't miss out on Ring Light. Adjustable brightness for perfect lighting. enhance performance. Upgrade now - stock is limited!
Slow Cooker,Home & Kitchen,Set-and-forget cooking for busy families,"Packed with premium quality, easy setup, and more. Slow Cooker Set-and-forget cooking for busy families. Order now today!"
Face Masks,Personal Care,Hydrating sheet masks for spa days,Experience boost productivity with Face Masks. Hydrating sheet masks for spa days. enhance performance included. Buy today today!
Wine Opener,Home & Kitchen,Electric corkscrew for effortless opening,Tired of poor quality? Wine Opener is your solution! Electric corkscrew for effortless opening. maximize results. Experience the difference!
Mouse Pad,Office Supplies,Large gaming surface,Tired of uncomfortable use? Mouse Pad is your solution! Large gaming surface. save money. Start saving!
Yoga Strap,Sports & Fitness,Improve flexibility and reach,"Join 50,000+ happy customers! Yoga Strap - Improve flexibility and reach. save time. Shop now!"
Ab Wheel,Sports & Fitness,Core strengthening roller,Say goodbye to high costs. Ab Wheel Core strengthening roller. reduce stress. Get yours today!
Tea Infuser,Home & Kitchen,Stainless mesh for loose leaf tea,Struggling with limited features? Our Tea Infuser changes everything. Stainless mesh for loose leaf tea. Start saving!
Keychain,Accessories,Multi-tool with LED light,Last chance! Keychain Multi-tool with LED light. enhance performance. Experience the difference while supplies last!
Gloves,Clothing,Touchscreen-compatible winter gloves,Experience boost productivity with Gloves. Touchscreen-compatible winter gloves. reduce stress included. Get yours today!
Dumb bells,Sports & Fitness,Adjustable weights for home workouts,Get boost productivity and save money with our Dumb bells. Adjustable weights for home workouts. Buy today now!
Tie,Accessories,Silk necktie in classic patterns,"Tie features premium quality, easy setup, and lifetime warranty. Silk necktie in classic patterns. Try it!"
Kitchen Scale,Home & Kitchen,Digital precision for perfect recipes,Kitchen Scale includes premium quality and easy setup. Digital precision for perfect recipes. Buy today now!
Backpack,Accessories,Waterproof with laptop compartment,"Packed with premium quality, easy setup, and more. Backpack Waterproof with laptop compartment. Get yours today!"
Jump Rope,Sports & Fitness,Speed rope for cardio training,Last chance! Jump Rope Speed rope for cardio training. save time. Shop now while supplies last!
Phone Case,Electronics,Durable protection with wireless charging support,"Phone Case: Rated 5 stars by 25,000+ users. Durable protection with wireless charging support. reduce stress. Get yours now!"
Binder Clips,Office Supplies,Assorted sizes for any project,Last chance! Binder Clips Assorted sizes for any project. increase comfort. Buy today while supplies last!
Power Bank,Electronics,High-capacity portable charger with fast charging,"Power Bank features premium quality, easy setup, and lifetime warranty. High-capacity portable charger with fast charging. Don't wait!"
Backpack,Accessories,Waterproof with laptop compartment,Struggling with high costs? Our Backpack changes everything. Waterproof with laptop compartment. Start saving!
Sunglasses,Accessories,Polarized UV400 protection,Get maximize results and simplify life with our Sunglasses. Polarized UV400 protection. Order now now!
Wallet,Accessories,Slim bifold genuine leather,Last chance! Wallet Slim bifold genuine leather. improve quality. Try it while supplies last!
Jacket,Clothing,Waterproof windbreaker for outdoors,Get simplify life and save time with our Jacket. Waterproof windbreaker for outdoors. Make the switch now!
Stapler,Office Supplies,Heavy-duty metal construction,Tired of unreliable performance? Stapler is your solution! Heavy-duty metal construction. increase comfort. Try it!
Boxing Gloves,Sports & Fitness,Padded gloves for training,Boxing Gloves includes premium quality and easy setup. Padded gloves for training. Shop now now!
Mouse Pad,Office Supplies,Large gaming surface,"Mouse Pad features premium quality, easy setup, and lifetime warranty. Large gaming surface. Experience the difference!"
Webcam HD,Electronics,1080p camera with auto-focus and built-in microphone,Last chance! Webcam HD 1080p camera with auto-focus and built-in microphone. eliminate hassle. Shop now while supplies last!
