product_name,category,description,ad_copy
Electric Kettle,Home & Kitchen,Fast boiling with auto shut-off safety,Don't miss out on Electric Kettle. Fast boiling with auto shut-off safety. save money. Try it - stock is limited!
Razor,Personal Care,Multi-blade for smooth shave,Razor includes premium quality and easy setup. Multi-blade for smooth shave. Upgrade now now!
Food Storage Containers,Home & Kitchen,Air-tight BPA-free containers,Last chance! Food Storage Containers Air-tight BPA-free containers. maximize results. Experience the difference while supplies last!
File Folders,Office Supplies,Durable manila folders,"Packed with premium quality, easy setup, and more. File Folders Durable manila folders. Shop now today!"
Mechanical Keyboard,Electronics,Tactile switches with customizable backlighting,"Trusted by 150,000+ customers. Mechanical Keyboard Tactile switches with customizable backlighting. Buy today today!"
Toaster Oven,Home & Kitchen,Compact convection oven for any task,Get maximize results and reduce stress with our Toaster Oven. Compact convection oven for any task. Order now now!
Hat,Clothing,Adjustable baseball cap,"Trusted by 100,000+ customers. Hat Adjustable baseball cap. Experience the difference today!"
Highlighters,Office Supplies,Vibrant colors that don't bleed,Struggling with wasted time? Our Highlighters changes everything. Vibrant colors that don't bleed. Upgrade now!
Push-Up Bars,Sports & Fitness,Elevated handles for better form,Last chance! Push-Up Bars Elevated handles for better form. save time. Shop now while supplies last!
Phone Gimbal,Electronics,3-axis stabilizer for smooth video recording,Don't miss out on Phone Gimbal. 3-axis stabilizer for smooth video recording. save money. Shop now - stock is limited!
Wireless Earbuds,Electronics,True wireless with charging case and touch controls,"Wireless Earbuds features premium quality, easy setup, and lifetime warranty. True wireless with charging case and touch controls. Shop now!"
Push-Up Bars,Sports & Fitness,Elevated handles for better form,"Join 100,000+ happy customers! Push-Up Bars - Elevated handles for better form. simplify life. Try it!"
Sweatpants,Clothing,Cozy joggers for lounging,"Join 10,000+ happy customers! Sweatpants - Cozy joggers for lounging. boost productivity. Upgrade now!"
Belt,Accessories,Reversible genuine leather belt,Struggling with outdated technology? Our Belt changes everything. Reversible genuine leather belt. Make the switch!
Stainless Steel Water Bottle,Home & Kitchen,Insulated to keep drinks cold or hot all day,"Stainless Steel Water Bottle features premium quality, easy setup, and lifetime warranty. Insulated to keep drinks cold or hot all day. Shop now!"
Nail Clippers,Personal Care,Precision stainless steel set,Nail Clippers includes premium quality and easy setup. Precision stainless steel set. Upgrade now now!
Spice Rack,Home & Kitchen,Organize all spices with rotating stand,Tired of high costs? Spice Rack is your solution! Organize all spices with rotating stand. save time. Don't wait!
Socks Pack,Clothing,Comfortable cushioned athletic socks,"Packed with premium quality, easy setup, and more. Socks Pack Comfortable cushioned athletic socks. Don't wait today!"
Facial Cleanser,Personal Care,Gentle formula for all skin types,Tired of uncomfortable use? Facial Cleanser is your solution! Gentle formula for all skin types. increase comfort. Get yours!
Tie,Accessories,Silk necktie in classic patterns,Get boost productivity and maximize results with our Tie. Silk necktie in classic patterns. Make the switch now!
Food Storage Containers,Home & Kitchen,Air-tight BPA-free containers,"Join 100,000+ happy customers! Food Storage Containers - Air-tight BPA-free containers. maximize results. Try it!"
Moisturizer,Personal Care,Hydrating cream with SPF protection,"Moisturizer features premium quality, easy setup, and lifetime warranty. Hydrating cream with SPF protection. Make the switch!"
Ankle Weights,Sports & Fitness,Adjustable weights for leg exercises,Get eliminate hassle and improve quality with our Ankle Weights. Adjustable weights for leg exercises. Try it now!
Blender,Home & Kitchen,Powerful motor for smooth smoothies and shakes,Struggling with complicated setups? Our Blender changes everything. Powerful motor for smooth smoothies and shakes. Don't wait!
Sweatpants,Clothing,Cozy joggers for lounging,"Join 150,000+ happy customers! Sweatpants - Cozy joggers for lounging. boost productivity. Buy today!"
Tote Bag,Accessories,Canvas reusable shopping bag,"Packed with premium quality, easy setup, and more. Tote Bag Canvas reusable shopping bag. Get yours today!"
Push-Up Bars,Sports & Fitness,Elevated handles for better form,Push-Up Bars delivers enhance performance and improve quality. Elevated handles for better form. Perfect for professionals. Order now!
Spice Rack,Home & Kitchen,Organize all spices with rotating stand,"Trusted by 25,000+ customers. Spice Rack Organize all spices with rotating stand. Make the switch today!"
Phone Case,Electronics,Durable protection with wireless charging support,Last chance! Phone Case Durable protection with wireless charging support. reduce stress. Shop now while supplies last!
Trash Bags,Home & Kitchen,Heavy-duty leak-proof bags,"Join 50,000+ happy customers! Trash Bags - Heavy-duty leak-proof bags. improve quality. Try it!"
Hair Dryer,Personal Care,Ionic technology for shinier hair,"Join 25,000+ happy customers! Hair Dryer - Ionic technology for shinier hair. simplify life. Don't wait!"
Smart Watch,Wearables,Fitness tracking with heart rate monitor and GPS,"Smart Watch features premium quality, easy setup, and lifetime warranty. Fitness tracking with heart rate monitor and GPS. Upgrade now!"
Cable Organizer,Electronics,Keep all cables tangle-free and organized,Tired of uncomfortable use? Cable Organizer is your solution! Keep all cables tangle-free and organized. maximize results. Buy today!
Kettlebell,Sports & Fitness,Cast iron weight for strength training,Don't miss out on Kettlebell. Cast iron weight for strength training. reduce stress. Get yours - stock is limited!
Webcam HD,Electronics,1080p camera with auto-focus and built-in microphone,Last chance! Webcam HD 1080p camera with auto-focus and built-in microphone. boost productivity. Shop now while supplies last!
Gloves,Clothing,Touchscreen-compatible winter gloves,Tired of uncomfortable use? Gloves is your solution! Touchscreen-compatible winter gloves. simplify life. Shop now!
Wireless Charger,Electronics,Fast charging pad for all Qi-enabled devices,Say goodbye to outdated technology. Wireless Charger Fast charging pad for all Qi-enabled devices. maximize results. Upgrade now today!
Wallet,Accessories,Slim bifold genuine leather,"Trusted by 25,000+ customers. Wallet Slim bifold genuine leather. Experience the difference today!"
Boxing Gloves,Sports & Fitness,Padded gloves for training,Last chance! Boxing Gloves Padded gloves for training. increase comfort. Start saving while supplies last!
Shampoo,Personal Care,Sulfate-free for healthy hair,Say goodbye to uncomfortable use. Shampoo Sulfate-free for healthy hair. increase comfort. Experience the difference today!
Pull-Up Bar,Sports & Fitness,Doorway-mounted bar for upper body,"Pull-Up Bar: Rated 5 stars by 150,000+ users. Doorway-mounted bar for upper body. increase comfort. Upgrade now now!"
Binder Clips,Office Supplies,Assorted sizes for any project,"Packed with premium quality, easy setup, and more. Binder Clips Assorted sizes for any project. Start saving today!"
Smart Watch,Wearables,Fitness tracking with heart rate monitor and GPS,"Trusted by 10,000+ customers. Smart Watch Fitness tracking with heart rate monitor and GPS. Try it today!"
Scarf,Accessories,Soft cashmere blend,Tired of limited features? Scarf is your solution! Soft cashmere blend. simplify life. Experience the difference!
Tie,Accessories,Silk necktie in classic patterns,Struggling with outdated technology? Our Tie changes everything. Silk necktie in classic patterns. Order now!
Belt,Accessories,Reversible genuine leather belt,Belt delivers save time and simplify life. Reversible genuine leather belt. Perfect for travelers. Experience the difference!
Cologne,Personal Care,Long-lasting sophisticated scent,Get save time and increase comfort with our Cologne. Long-lasting sophisticated scent. Make the switch now!
Dash Cam,Electronics,HD car camera with loop recording and night vision,Tired of limited features? Dash Cam is your solution! HD car camera with loop recording and night vision. boost productivity. Don't wait!
Wireless Headphones,Electronics,Premium sound with noise cancellation and long battery,Wireless Headphones includes premium quality and easy setup. Premium sound with noise cancellation and long battery. Make the switch now!
Face Masks,Personal Care,Hydrating sheet masks for spa days,Don't miss out on Face Masks. Hydrating sheet masks for spa days. save time. Get yours - stock is limited!
Electric Kettle,Home & Kitchen,Fast boiling with auto shut-off safety,"Trusted by 10,000+ customers. Electric Kettle Fast boiling with auto shut-off safety. Don't wait today!"
Backpack,Accessories,Waterproof with laptop compartment,Backpack includes premium quality and easy setup. Waterproof with laptop compartment. Experience the difference now!
Electric Kettle,Home & Kitchen,Fast boiling with auto shut-off safety,"Electric Kettle: Rated 5 stars by 10,000+ users. Fast boiling with auto shut-off safety. eliminate hassle. Start saving now!"
Laptop Cooling Pad,Electronics,Dual fans to prevent overheating,"Packed with premium quality, easy setup, and more. Laptop Cooling Pad Dual fans to prevent overheating. Start saving today!"
Wireless Headphones,Electronics,Premium sound with noise cancellation and long battery,"Wireless Headphones features premium quality, easy setup, and lifetime warranty. Premium sound with noise cancellation and long battery. Buy today!"
Cutting Board Set,Home & Kitchen,Bamboo boards in multiple sizes,"Cutting Board Set: Rated 5 stars by 50,000+ users. Bamboo boards in multiple sizes. eliminate hassle. Make the switch now!"
Foam Roller,Sports & Fitness,Muscle recovery and massage tool,Say goodbye to uncomfortable use. Foam Roller Muscle recovery and massage tool. save money. Shop now today!
Gaming Mouse,Electronics,Precision wireless mouse with RGB lighting,Get improve quality and save time with our Gaming Mouse. Precision wireless mouse with RGB lighting. Try it now!
Exercise Ball,Sports & Fitness,Stability ball for core workouts,Experience increase comfort with Exercise Ball. Stability ball for core workouts. eliminate hassle included. Experience the difference today!
Backpack,Accessories,Waterproof with laptop compartment,"Join 50,000+ happy customers! Backpack - Waterproof with laptop compartment. save money. Shop now!"
Mouse Pad,Office Supplies,Large gaming surface,Experience save time with Mouse Pad. Large gaming surface. eliminate hassle included. Make the switch today!
Kitchen Scale,Home & Kitchen,Digital precision for perfect recipes,Experience enhance performance with Kitchen Scale. Digital precision for perfect recipes. save time included. Order now today!
Jump Rope,Sports & Fitness,Speed rope for cardio training,Last chance! Jump Rope Speed rope for cardio training. increase comfort. Try it while supplies last!
Smart Plug,Electronics,WiFi-enabled outlet with voice control,Say goodbye to unreliable performance. Smart Plug WiFi-enabled outlet with voice control. boost productivity. Get yours today!
Measuring Cups,Home & Kitchen,Stainless steel for accurate measurements,Get increase comfort and increase comfort with our Measuring Cups. Stainless steel for accurate measurements. Shop now now!
Sticky Notes,Office Supplies,Adhesive notes in assorted sizes,Get boost productivity and eliminate hassle with our Sticky Notes. Adhesive notes in assorted sizes. Make the switch now!
Wireless Charger,Electronics,Fast charging pad for all Qi-enabled devices,Don't miss out on Wireless Charger. Fast charging pad for all Qi-enabled devices. maximize results. Make the switch - stock is limited!
Phone Case,Electronics,Durable protection with wireless charging support,"Trusted by 10,000+ customers. Phone Case Durable protection with wireless charging support. Try it today!"
Smart Light Bulbs,Electronics,WiFi-enabled color-changing LED bulbs,Experience improve quality with Smart Light Bulbs. WiFi-enabled color-changing LED bulbs. enhance performance included. Try it today!
Food Storage Containers,Home & Kitchen,Air-tight BPA-free containers,Last chance! Food Storage Containers Air-tight BPA-free containers. maximize results. Experience the difference while supplies last!
Desk Organizer,Office Supplies,Bamboo organizer with compartments,Limited time! Get Desk Organizer now. Bamboo organizer with compartments. reduce stress. Buy today before it's gone!
Exercise Ball,Sports & Fitness,Stability ball for core workouts,"Packed with premium quality, easy setup, and more. Exercise Ball Stability ball for core workouts. Order now today!"
Stainless Steel Water Bottle,Home & Kitchen,Insulated to keep drinks cold or hot all day,"Trusted by 100,000+ customers. Stainless Steel Water Bottle Insulated to keep drinks cold or hot all day. Start saving today!"
Hair Dryer,Personal Care,Ionic technology for shinier hair,"Hair Dryer features premium quality, easy setup, and lifetime warranty. Ionic technology for shinier hair. Experience the difference!"
Phone Case,Electronics,Durable protection with wireless charging support,Experience improve quality with Phone Case. Durable protection with wireless charging support. reduce stress included. Upgrade now today!
Boxing Gloves,Sports & Fitness,Padded gloves for training,"Join 10,000+ happy customers! Boxing Gloves - Padded gloves for training. save money. Experience the difference!"
Belt,Accessories,Reversible genuine leather belt,Say goodbye to frequent breakdowns. Belt Reversible genuine leather belt. improve quality. Make the switch today!
Slow Cooker,Home & Kitchen,Set-and-forget cooking for busy families,Don't miss out on Slow Cooker. Set-and-forget cooking for busy families. maximize results. Don't wait - stock is limited!
Tweezers,Personal Care,Slant-tip for perfect plucking,"Tweezers features premium quality, easy setup, and lifetime warranty. Slant-tip for perfect plucking. Get yours!"
Knife Set,Home & Kitchen,Professional-grade stainless steel blades,Experience maximize results with Knife Set. Professional-grade stainless steel blades. maximize results included. Get yours today!
Cologne,Personal Care,Long-lasting sophisticated scent,"Trusted by 50,000+ customers. Cologne Long-lasting sophisticated scent. Get yours today!"
Jeans,Clothing,Classic fit denim that lasts,Jeans includes premium quality and easy setup. Classic fit denim that lasts. Make the switch now!
Body Lotion,Personal Care,Nourishing formula for soft skin,Body Lotion delivers improve quality and boost productivity. Nourishing formula for soft skin. Perfect for home chefs. Buy today!
Backpack,Accessories,Waterproof with laptop compartment,Limited time! Get Backpack now. Waterproof with laptop compartment. simplify life. Don't wait before it's gone!
Jeans,Clothing,Classic fit denim that lasts,Jeans includes premium quality and easy setup. Classic fit denim that lasts. Get yours now!
Scarf,Accessories,Soft cashmere blend,Struggling with poor quality? Our Scarf changes everything. Soft cashmere blend. Start saving!
Mixing Bowls,Home & Kitchen,Nesting set with non-slip bases,Mixing Bowls delivers save money and boost productivity. Nesting set with non-slip bases. Perfect for families. Experience the difference!
Mechanical Keyboard,Electronics,Tactile switches with customizable backlighting,"Mechanical Keyboard: Rated 5 stars by 100,000+ users. Tactile switches with customizable backlighting. improve quality. Make the switch now!"
Tablet Stand,Electronics,Adjustable aluminum stand for all devices,Tablet Stand delivers boost productivity and improve quality. Adjustable aluminum stand for all devices. Perfect for home chefs. Make the switch!
Slow Cooker,Home & Kitchen,Set-and-forget cooking for busy families,Limited time! Get Slow Cooker now. Set-and-forget cooking for busy families. boost productivity. Try it before it's gone!
Tea Infuser,Home & Kitchen,Stainless mesh for loose leaf tea,Experience maximize results with Tea Infuser. Stainless mesh for loose leaf tea. increase comfort included. Get yours today!
Laptop Cooling Pad,Electronics,Dual fans to prevent overheating,Say goodbye to outdated technology. Laptop Cooling Pad Dual fans to prevent overheating. reduce stress. Buy today today!
Shampoo,Personal Care,Sulfate-free for healthy hair,Shampoo includes premium quality and easy setup. Sulfate-free for healthy hair. Don't wait now!
Gloves,Clothing,Touchscreen-compatible winter gloves,Say goodbye to complicated setups. Gloves Touchscreen-compatible winter gloves. eliminate hassle. Upgrade now today!
Ring Light,Electronics,Adjustable brightness for perfect lighting,Say goodbye to outdated technology. Ring Light Adjustable brightness for perfect lighting. save time. Get yours today!
Air Fryer,Home & Kitchen,Healthier cooking with little to no oil needed,"Trusted by 50,000+ customers. Air Fryer Healthier cooking with little to no oil needed. Don't wait today!"
French Press,Home & Kitchen,Brew rich coffee in minutes,Limited time! Get French Press now. Brew rich coffee in minutes. improve quality. Get yours before it's gone!
Kitchen Scale,Home & Kitchen,Digital precision for perfect recipes,Last chance! Kitchen Scale Digital precision for perfect recipes. save money. Get yours while supplies last!
Hoodie,Clothing,Warm fleece with kangaroo pocket,Experience enhance performance with Hoodie. Warm fleece with kangaroo pocket. simplify life included. Upgrade now today!
Tank Top,Clothing,Breathable fabric for workouts,"Join 25,000+ happy customers! Tank Top - Breathable fabric for workouts. eliminate hassle. Start saving!"
Electric Toothbrush,Personal Care,Sonic cleaning with smart timer,Say goodbye to unreliable performance. Electric Toothbrush Sonic cleaning with smart timer. enhance performance. Don't wait today!
Tea Infuser,Home & Kitchen,Stainless mesh for loose leaf tea,Tired of complicated setups? Tea Infuser is your solution! Stainless mesh for loose leaf tea. improve quality. Order now!
Sweatpants,Clothing,Cozy joggers for lounging,"Packed with premium quality, easy setup, and more. Sweatpants Cozy joggers for lounging. Shop now today!"
Makeup Brushes,Personal Care,Professional quality synthetic bristles,Struggling with uncomfortable use? Our Makeup Brushes changes everything. Professional quality synthetic bristles. Start saving!
Smart Watch,Wearables,Fitness tracking with heart rate monitor and GPS,Tired of unreliable performance? Smart Watch is your solution! Fitness tracking with heart rate monitor and GPS. save money. Shop now!
Yoga Blocks,Sports & Fitness,Supportive props for proper alignment,Get improve quality and increase comfort with our Yoga Blocks. Supportive props for proper alignment. Order now now!
Electric Kettle,Home & Kitchen,Fast boiling with auto shut-off safety,Electric Kettle includes premium quality and easy setup. Fast boiling with auto shut-off safety. Upgrade now now!
Face Masks,Personal Care,Hydrating sheet masks for spa days,"Face Masks features premium quality, easy setup, and lifetime warranty. Hydrating sheet masks for spa days. Experience the difference!"
Sweatpants,Clothing,Cozy joggers for lounging,Last chance! Sweatpants Cozy joggers for lounging. boost productivity. Try it while supplies last!
Exercise Ball,Sports & Fitness,Stability ball for core workouts,"Join 25,000+ happy customers! Exercise Ball - Stability ball for core workouts. save money. Don't wait!"
French Press,Home & Kitchen,Brew rich coffee in minutes,Last chance! French Press Brew rich coffee in minutes. enhance performance. Start saving while supplies last!
Slow Cooker,Home & Kitchen,Set-and-forget cooking for busy families,Get save time and save time with our Slow Cooker. Set-and-forget cooking for busy families. Don't wait now!
Mechanical Keyboard,Electronics,Tactile switches with customizable backlighting,Say goodbye to complicated setups. Mechanical Keyboard Tactile switches with customizable backlighting. improve quality. Experience the difference today!
Notebook,Office Supplies,Hardcover journal with lined pages,Tired of complicated setups? Notebook is your solution! Hardcover journal with lined pages. eliminate hassle. Shop now!
Measuring Cups,Home & Kitchen,Stainless steel for accurate measurements,Struggling with wasted time? Our Measuring Cups changes everything. Stainless steel for accurate measurements. Try it!
Sweatpants,Clothing,Cozy joggers for lounging,Sweatpants delivers maximize results and save time. Cozy joggers for lounging. Perfect for gamers. Make the switch!
Sticky Notes,Office Supplies,Adhesive notes in assorted sizes,Get boost productivity and reduce stress with our Sticky Notes. Adhesive notes in assorted sizes. Buy today now!
Air Fryer,Home & Kitchen,Healthier cooking with little to no oil needed,Last chance! Air Fryer Healthier cooking with little to no oil needed. eliminate hassle. Get yours while supplies last!
Smart Light Bulbs,Electronics,WiFi-enabled color-changing LED bulbs,Experience simplify life with Smart Light Bulbs. WiFi-enabled color-changing LED bulbs. enhance performance included. Get yours today!
Cutting Board Set,Home & Kitchen,Bamboo boards in multiple sizes,"Packed with premium quality, easy setup, and more. Cutting Board Set Bamboo boards in multiple sizes. Upgrade now today!"
Makeup Brushes,Personal Care,Professional quality synthetic bristles,Experience boost productivity with Makeup Brushes. Professional quality synthetic bristles. simplify life included. Experience the difference today!
Resistance Bands,Sports & Fitness,Complete set with multiple resistance levels,"Resistance Bands features premium quality, easy setup, and lifetime warranty. Complete set with multiple resistance levels. Make the switch!"
Tablet Stand,Electronics,Adjustable aluminum stand for all devices,Last chance! Tablet Stand Adjustable aluminum stand for all devices. enhance performance. Try it while supplies last!
Wireless Charger,Electronics,Fast charging pad for all Qi-enabled devices,Wireless Charger delivers maximize results and eliminate hassle. Fast charging pad for all Qi-enabled devices. Perfect for travelers. Order now!
Yoga Blocks,Sports & Fitness,Supportive props for proper alignment,"Trusted by 150,000+ customers. Yoga Blocks Supportive props for proper alignment. Make the switch today!"
Desk Lamp,Office Supplies,LED with adjustable brightness,Desk Lamp delivers maximize results and reduce stress. LED with adjustable brightness. Perfect for students. Order now!
Phone Case,Electronics,Durable protection with wireless charging support,"Packed with premium quality, easy setup, and more. Phone Case Durable protection with wireless charging support. Start saving today!"
Jeans,Clothing,Classic fit denim that lasts,"Join 100,000+ happy customers! Jeans - Classic fit denim that lasts. enhance performance. Get yours!"
Binder Clips,Office Supplies,Assorted sizes for any project,"Trusted by 50,000+ customers. Binder Clips Assorted sizes for any project. Experience the difference today!"
Yoga Strap,Sports & Fitness,Improve flexibility and reach,Last chance! Yoga Strap Improve flexibility and reach. increase comfort. Try it while supplies last!
Belt,Accessories,Reversible genuine leather belt,"Join 10,000+ happy customers! Belt - Reversible genuine leather belt. simplify life. Upgrade now!"
Air Fryer,Home & Kitchen,Healthier cooking with little to no oil needed,Say goodbye to limited features. Air Fryer Healthier cooking with little to no oil needed. reduce stress. Shop now today!
Tie,Accessories,Silk necktie in classic patterns,"Tie features premium quality, easy setup, and lifetime warranty. Silk necktie in classic patterns. Experience the difference!"
Ankle Weights,Sports & Fitness,Adjustable weights for leg exercises,Say goodbye to limited features. Ankle Weights Adjustable weights for leg exercises. boost productivity. Start saving today!
Yoga Blocks,Sports & Fitness,Supportive props for proper alignment,Tired of complicated setups? Yoga Blocks is your solution! Supportive props for proper alignment. enhance performance. Try it!
Keychain,Accessories,Multi-tool with LED light,"Trusted by 50,000+ customers. Keychain Multi-tool with LED light. Shop now today!"
Phone Gimbal,Electronics,3-axis stabilizer for smooth video recording,Phone Gimbal delivers increase comfort and boost productivity. 3-axis stabilizer for smooth video recording. Perfect for students. Start saving!
Tea Infuser,Home & Kitchen,Stainless mesh for loose leaf tea,"Trusted by 25,000+ customers. Tea Infuser Stainless mesh for loose leaf tea. Get yours today!"
Boxing Gloves,Sports & Fitness,Padded gloves for training,Struggling with poor quality? Our Boxing Gloves changes everything. Padded gloves for training. Shop now!
Phone Gimbal,Electronics,3-axis stabilizer for smooth video recording,"Packed with premium quality, easy setup, and more. Phone Gimbal 3-axis stabilizer for smooth video recording. Start saving today!"
Balance Board,Sports & Fitness,Wooden board for stability training,Struggling with unreliable performance? Our Balance Board changes everything. Wooden board for stability training. Upgrade now!
Can Opener,Home & Kitchen,Smooth-edge safe opener,Limited time! Get Can Opener now. Smooth-edge safe opener. improve quality. Make the switch before it's gone!
Wine Opener,Home & Kitchen,Electric corkscrew for effortless opening,"Wine Opener: Rated 5 stars by 25,000+ users. Electric corkscrew for effortless opening. save time. Don't wait now!"
