product_name,category,description,ad_copy
Boxing Gloves,Sports & Fitness,Padded gloves for training,"Trusted by 150,000+ customers. Boxing Gloves Padded gloves for training. Try it today!"
Lip Balm Set,Personal Care,Moisturizing balms in multiple flavors,Limited time! Get Lip Balm Set now. Moisturizing balms in multiple flavors. simplify life. Upgrade now before it's gone!
Power Bank,Electronics,High-capacity portable charger with fast charging,Say goodbye to limited features. Power Bank High-capacity portable charger with fast charging. enhance performance. Shop now today!
T-Shirt,Clothing,100% organic cotton in multiple colors,"Trusted by 150,000+ customers. T-Shirt 100% organic cotton in multiple colors. Try it today!"
Backpack,Accessories,Waterproof with laptop compartment,Don't miss out on Backpack. Waterproof with laptop compartment. eliminate hassle. Experience the difference - stock is limited!
Tank Top,Clothing,Breathable fabric for workouts,Last chance! Tank Top Breathable fabric for workouts. boost productivity. Don't wait while supplies last!
Coffee Maker,Home & Kitchen,Programmable machine that brews perfect coffee,Last chance! Coffee Maker Programmable machine that brews perfect coffee. save time. Try it while supplies last!
Exercise Ball,Sports & Fitness,Stability ball for core workouts,"Trusted by 150,000+ customers. Exercise Ball Stability ball for core workouts. Get yours today!"
Electric Toothbrush,Personal Care,Sonic cleaning with smart timer,"Packed with premium quality, easy setup, and more. Electric Toothbrush Sonic cleaning with smart timer. Buy today today!"
Measuring Cups,Home & Kitchen,Stainless steel for accurate measurements,Get increase comfort and save money with our Measuring Cups. Stainless steel for accurate measurements. Upgrade now now!
Notebook,Office Supplies,Hardcover journal with lined pages,"Notebook features premium quality, easy setup, and lifetime warranty. Hardcover journal with lined pages. Try it!"
Smart Watch,Wearables,Fitness tracking with heart rate monitor and GPS,Smart Watch includes premium quality and easy setup. Fitness tracking with heart rate monitor and GPS. Upgrade now now!
Wine Opener,Home & Kitchen,Electric corkscrew for effortless opening,Limited time! Get Wine Opener now. Electric corkscrew for effortless opening. reduce stress. Try it before it's gone!
Dumb bells,Sports & Fitness,Adjustable weights for home workouts,"Trusted by 10,000+ customers. Dumb bells Adjustable weights for home workouts. Shop now today!"
Stainless Steel Water Bottle,Home & Kitchen,Insulated to keep drinks cold or hot all day,Say goodbye to frequent breakdowns. Stainless Steel Water Bottle Insulated to keep drinks cold or hot all day. increase comfort. Upgrade now today!
Yoga Mat,Sports & Fitness,Non-slip cushioned mat for all exercises,Last chance! Yoga Mat Non-slip cushioned mat for all exercises. simplify life. Don't wait while supplies last!
Cable Organizer,Electronics,Keep all cables tangle-free and organized,Cable Organizer includes premium quality and easy setup. Keep all cables tangle-free and organized. Don't wait now!
Yoga Mat,Sports & Fitness,Non-slip cushioned mat for all exercises,Say goodbye to wasted time. Yoga Mat Non-slip cushioned mat for all exercises. save time. Don't wait today!
Mixing Bowls,Home & Kitchen,Nesting set with non-slip bases,Mixing Bowls delivers enhance performance and enhance performance. Nesting set with non-slip bases. Perfect for families. Get yours!
Balance Board,Sports & Fitness,Wooden board for stability training,Tired of outdated technology? Balance Board is your solution! Wooden board for stability training. improve quality. Don't wait!
Screen Protector,Electronics,Tempered glass protection for phones,"Trusted by 10,000+ customers. Screen Protector Tempered glass protection for phones. Shop now today!"
Highlighters,Office Supplies,Vibrant colors that don't bleed,"Highlighters: Rated 5 stars by 10,000+ users. Vibrant colors that don't bleed. save time. Make the switch now!"
Measuring Cups,Home & Kitchen,Stainless steel for accurate measurements,Get simplify life and save money with our Measuring Cups. Stainless steel for accurate measurements. Upgrade now now!
Razor,Personal Care,Multi-blade for smooth shave,"Packed with premium quality, easy setup, and more. Razor Multi-blade for smooth shave. Start saving today!"
Wine Opener,Home & Kitchen,Electric corkscrew for effortless opening,Struggling with frequent breakdowns? Our Wine Opener changes everything. Electric corkscrew for effortless opening. Make the switch!
Jacket,Clothing,Waterproof windbreaker for outdoors,Limited time! Get Jacket now. Waterproof windbreaker for outdoors. save money. Upgrade now before it's gone!
Boxing Gloves,Sports & Fitness,Padded gloves for training,Don't miss out on Boxing Gloves. Padded gloves for training. reduce stress. Experience the difference - stock is limited!
Push-Up Bars,Sports & Fitness,Elevated handles for better form,Experience eliminate hassle with Push-Up Bars. Elevated handles for better form. eliminate hassle included. Try it today!
Tie,Accessories,Silk necktie in classic patterns,Say goodbye to poor quality. Tie Silk necktie in classic patterns. maximize results. Upgrade now today!
Socks Pack,Clothing,Comfortable cushioned athletic socks,Socks Pack delivers simplify life and boost productivity. Comfortable cushioned athletic socks. Perfect for gamers. Buy today!
Smart Plug,Electronics,WiFi-enabled outlet with voice control,Say goodbye to unreliable performance. Smart Plug WiFi-enabled outlet with voice control. reduce stress. Order now today!
Desk Organizer,Office Supplies,Bamboo organizer with compartments,Tired of wasted time? Desk Organizer is your solution! Bamboo organizer with compartments. increase comfort. Get yours!
Smart Plug,Electronics,WiFi-enabled outlet with voice control,"Join 50,000+ happy customers! Smart Plug - WiFi-enabled outlet with voice control. eliminate hassle. Buy today!"
Makeup Brushes,Personal Care,Professional quality synthetic bristles,Limited time! Get Makeup Brushes now. Professional quality synthetic bristles. boost productivity. Experience the difference before it's gone!
Conditioner,Personal Care,Deep conditioning treatment,Conditioner delivers improve quality and save money. Deep conditioning treatment. Perfect for tech enthusiasts. Buy today!
Trash Bags,Home & Kitchen,Heavy-duty leak-proof bags,"Trash Bags features premium quality, easy setup, and lifetime warranty. Heavy-duty leak-proof bags. Start saving!"
Cologne,Personal Care,Long-lasting sophisticated scent,"Join 10,000+ happy customers! Cologne - Long-lasting sophisticated scent. increase comfort. Make the switch!"
Phone Case,Electronics,Durable protection with wireless charging support,Get enhance performance and enhance performance with our Phone Case. Durable protection with wireless charging support. Upgrade now now!
Desk Organizer,Office Supplies,Bamboo organizer with compartments,Desk Organizer includes premium quality and easy setup. Bamboo organizer with compartments. Buy today now!
Smart Plug,Electronics,WiFi-enabled outlet with voice control,Smart Plug delivers simplify life and enhance performance. WiFi-enabled outlet with voice control. Perfect for tech enthusiasts. Upgrade now!
Watch,Accessories,Classic analog with leather strap,Get increase comfort and save money with our Watch. Classic analog with leather strap. Start saving now!
Coffee Maker,Home & Kitchen,Programmable machine that brews perfect coffee,Coffee Maker delivers maximize results and simplify life. Programmable machine that brews perfect coffee. Perfect for athletes. Start saving!
Dumb bells,Sports & Fitness,Adjustable weights for home workouts,Limited time! Get Dumb bells now. Adjustable weights for home workouts. increase comfort. Buy today before it's gone!
Electric Kettle,Home & Kitchen,Fast boiling with auto shut-off safety,Tired of complicated setups? Electric Kettle is your solution! Fast boiling with auto shut-off safety. enhance performance. Order now!
Shampoo,Personal Care,Sulfate-free for healthy hair,Say goodbye to unreliable performance. Shampoo Sulfate-free for healthy hair. maximize results. Start saving today!
Measuring Cups,Home & Kitchen,Stainless steel for accurate measurements,"Packed with premium quality, easy setup, and more. Measuring Cups Stainless steel for accurate measurements. Upgrade now today!"
Tablet Stand,Electronics,Adjustable aluminum stand for all devices,"Packed with premium quality, easy setup, and more. Tablet Stand Adjustable aluminum stand for all devices. Try it today!"
Yoga Blocks,Sports & Fitness,Supportive props for proper alignment,"Join 10,000+ happy customers! Yoga Blocks - Supportive props for proper alignment. save time. Buy today!"
Mouse Pad,Office Supplies,Large gaming surface,Limited time! Get Mouse Pad now. Large gaming surface. simplify life. Start saving before it's gone!
Hoodie,Clothing,Warm fleece with kangaroo pocket,Last chance! Hoodie Warm fleece with kangaroo pocket. eliminate hassle. Buy today while supplies last!
Wireless Charger,Electronics,Fast charging pad for all Qi-enabled devices,"Packed with premium quality, easy setup, and more. Wireless Charger Fast charging pad for all Qi-enabled devices. Get yours today!"
Measuring Cups,Home & Kitchen,Stainless steel for accurate measurements,Experience save time with Measuring Cups. Stainless steel for accurate measurements. save time included. Get yours today!
Yoga Mat,Sports & Fitness,Non-slip cushioned mat for all exercises,"Join 100,000+ happy customers! Yoga Mat - Non-slip cushioned mat for all exercises. maximize results. Upgrade now!"
French Press,Home & Kitchen,Brew rich coffee in minutes,"Trusted by 100,000+ customers. French Press Brew rich coffee in minutes. Order now today!"
Mixing Bowls,Home & Kitchen,Nesting set with non-slip bases,"Trusted by 50,000+ customers. Mixing Bowls Nesting set with non-slip bases. Order now today!"
Sweatpants,Clothing,Cozy joggers for lounging,"Packed with premium quality, easy setup, and more. Sweatpants Cozy joggers for lounging. Get yours today!"
Power Bank,Electronics,High-capacity portable charger with fast charging,Limited time! Get Power Bank now. High-capacity portable charger with fast charging. enhance performance. Get yours before it's gone!
Smart Watch,Wearables,Fitness tracking with heart rate monitor and GPS,"Trusted by 10,000+ customers. Smart Watch Fitness tracking with heart rate monitor and GPS. Upgrade now today!"
Wallet,Accessories,Slim bifold genuine leather,"Trusted by 10,000+ customers. Wallet Slim bifold genuine leather. Get yours today!"
Kitchen Scale,Home & Kitchen,Digital precision for perfect recipes,"Packed with premium quality, easy setup, and more. Kitchen Scale Digital precision for perfect recipes. Get yours today!"
Air Fryer,Home & Kitchen,Healthier cooking with little to no oil needed,Limited time! Get Air Fryer now. Healthier cooking with little to no oil needed. eliminate hassle. Experience the difference before it's gone!
Food Storage Containers,Home & Kitchen,Air-tight BPA-free containers,"Join 25,000+ happy customers! Food Storage Containers - Air-tight BPA-free containers. enhance performance. Upgrade now!"
Shampoo,Personal Care,Sulfate-free for healthy hair,Limited time! Get Shampoo now. Sulfate-free for healthy hair. boost productivity. Make the switch before it's gone!
USB-C Hub,Electronics,Multi-port adapter with HDMI and USB 3.0,Experience reduce stress with USB-C Hub. Multi-port adapter with HDMI and USB 3.0. save money included. Don't wait today!
Trash Bags,Home & Kitchen,Heavy-duty leak-proof bags,Tired of wasted time? Trash Bags is your solution! Heavy-duty leak-proof bags. eliminate hassle. Don't wait!
French Press,Home & Kitchen,Brew rich coffee in minutes,"Join 25,000+ happy customers! French Press - Brew rich coffee in minutes. eliminate hassle. Order now!"
Wallet,Accessories,Slim bifold genuine leather,"Wallet features premium quality, easy setup, and lifetime warranty. Slim bifold genuine leather. Order now!"
Nail Clippers,Personal Care,Precision stainless steel set,Nail Clippers includes premium quality and easy setup. Precision stainless steel set. Make the switch now!
Cutting Board Set,Home & Kitchen,Bamboo boards in multiple sizes,Last chance! Cutting Board Set Bamboo boards in multiple sizes. eliminate hassle. Make the switch while supplies last!
Sunglasses,Accessories,Polarized UV400 protection,"Trusted by 10,000+ customers. Sunglasses Polarized UV400 protection. Make the switch today!"
Notebook,Office Supplies,Hardcover journal with lined pages,"Join 50,000+ happy customers! Notebook - Hardcover journal with lined pages. save money. Buy today!"
Bluetooth Speaker,Electronics,Portable waterproof speaker with 360-degree sound,Experience save time with Bluetooth Speaker. Portable waterproof speaker with 360-degree sound. enhance performance included. Start saving today!
Instant Pot,Home & Kitchen,7-in-1 pressure cooker for fast meals,Struggling with poor quality? Our Instant Pot changes everything. 7-in-1 pressure cooker for fast meals. Make the switch!
Shampoo,Personal Care,Sulfate-free for healthy hair,Tired of unreliable performance? Shampoo is your solution! Sulfate-free for healthy hair. save time. Start saving!
Smart Watch,Wearables,Fitness tracking with heart rate monitor and GPS,Say goodbye to high costs. Smart Watch Fitness tracking with heart rate monitor and GPS. increase comfort. Order now today!
Foam Roller,Sports & Fitness,Muscle recovery and massage tool,"Packed with premium quality, easy setup, and more. Foam Roller Muscle recovery and massage tool. Order now today!"
Screen Protector,Electronics,Tempered glass protection for phones,Limited time! Get Screen Protector now. Tempered glass protection for phones. enhance performance. Start saving before it's gone!
Smart Light Bulbs,Electronics,WiFi-enabled color-changing LED bulbs,Struggling with unreliable performance? Our Smart Light Bulbs changes everything. WiFi-enabled color-changing LED bulbs. Shop now!
Tweezers,Personal Care,Slant-tip for perfect plucking,Say goodbye to wasted time. Tweezers Slant-tip for perfect plucking. boost productivity. Upgrade now today!
Measuring Cups,Home & Kitchen,Stainless steel for accurate measurements,"Join 50,000+ happy customers! Measuring Cups - Stainless steel for accurate measurements. eliminate hassle. Try it!"
Knife Set,Home & Kitchen,Professional-grade stainless steel blades,Get save money and enhance performance with our Knife Set. Professional-grade stainless steel blades. Order now now!
USB-C Hub,Electronics,Multi-port adapter with HDMI and USB 3.0,Don't miss out on USB-C Hub. Multi-port adapter with HDMI and USB 3.0. reduce stress. Upgrade now - stock is limited!
Tablet Stand,Electronics,Adjustable aluminum stand for all devices,Don't miss out on Tablet Stand. Adjustable aluminum stand for all devices. increase comfort. Upgrade now - stock is limited!
Phone Gimbal,Electronics,3-axis stabilizer for smooth video recording,Struggling with wasted time? Our Phone Gimbal changes everything. 3-axis stabilizer for smooth video recording. Experience the difference!
Pens,Office Supplies,Smooth-writing ballpoint pens,"Pens: Rated 5 stars by 10,000+ users. Smooth-writing ballpoint pens. improve quality. Try it now!"
Umbrella,Accessories,Compact auto-open windproof,Don't miss out on Umbrella. Compact auto-open windproof. eliminate hassle. Order now - stock is limited!
Power Bank,Electronics,High-capacity portable charger with fast charging,"Power Bank features premium quality, easy setup, and lifetime warranty. High-capacity portable charger with fast charging. Don't wait!"
Balance Board,Sports & Fitness,Wooden board for stability training,Last chance! Balance Board Wooden board for stability training. increase comfort. Upgrade now while supplies last!
Air Fryer,Home & Kitchen,Healthier cooking with little to no oil needed,"Trusted by 100,000+ customers. Air Fryer Healthier cooking with little to no oil needed. Don't wait today!"
Wine Opener,Home & Kitchen,Electric corkscrew for effortless opening,Don't miss out on Wine Opener. Electric corkscrew for effortless opening. simplify life. Don't wait - stock is limited!
Balance Board,Sports & Fitness,Wooden board for stability training,"Packed with premium quality, easy setup, and more. Balance Board Wooden board for stability training. Try it today!"
Ankle Weights,Sports & Fitness,Adjustable weights for leg exercises,"Packed with premium quality, easy setup, and more. Ankle Weights Adjustable weights for leg exercises. Don't wait today!"
Pull-Up Bar,Sports & Fitness,Doorway-mounted bar for upper body,"Packed with premium quality, easy setup, and more. Pull-Up Bar Doorway-mounted bar for upper body. Shop now today!"
Bluetooth Speaker,Electronics,Portable waterproof speaker with 360-degree sound,Say goodbye to unreliable performance. Bluetooth Speaker Portable waterproof speaker with 360-degree sound. save time. Start saving today!
Sunglasses,Accessories,Polarized UV400 protection,"Trusted by 150,000+ customers. Sunglasses Polarized UV400 protection. Buy today today!"
Foam Roller,Sports & Fitness,Muscle recovery and massage tool,"Foam Roller: Rated 5 stars by 50,000+ users. Muscle recovery and massage tool. reduce stress. Get yours now!"
Jeans,Clothing,Classic fit denim that lasts,"Jeans features premium quality, easy setup, and lifetime warranty. Classic fit denim that lasts. Make the switch!"
Keychain,Accessories,Multi-tool with LED light,Limited time! Get Keychain now. Multi-tool with LED light. simplify life. Shop now before it's gone!
Knife Set,Home & Kitchen,Professional-grade stainless steel blades,"Knife Set: Rated 5 stars by 25,000+ users. Professional-grade stainless steel blades. increase comfort. Try it now!"
Desk Lamp,Office Supplies,LED with adjustable brightness,"Desk Lamp: Rated 5 stars by 25,000+ users. LED with adjustable brightness. save money. Order now now!"
Electric Toothbrush,Personal Care,Sonic cleaning with smart timer,"Electric Toothbrush features premium quality, easy setup, and lifetime warranty. Sonic cleaning with smart timer. Get yours!"
Wireless Headphones,Electronics,Premium sound with noise cancellation and long battery,Last chance! Wireless Headphones Premium sound with noise cancellation and long battery. enhance performance. Start saving while supplies last!
Ring Light,Electronics,Adjustable brightness for perfect lighting,Tired of unreliable performance? Ring Light is your solution! Adjustable brightness for perfect lighting. boost productivity. Try it!
Highlighters,Office Supplies,Vibrant colors that don't bleed,"Packed with premium quality, easy setup, and more. Highlighters Vibrant colors that don't bleed. Buy today today!"
Notebook,Office Supplies,Hardcover journal with lined pages,"Join 10,000+ happy customers! Notebook - Hardcover journal with lined pages. increase comfort. Start saving!"
Body Lotion,Personal Care,Nourishing formula for soft skin,Don't miss out on Body Lotion. Nourishing formula for soft skin. increase comfort. Upgrade now - stock is limited!
Coffee Maker,Home & Kitchen,Programmable machine that brews perfect coffee,Tired of limited features? Coffee Maker is your solution! Programmable machine that brews perfect coffee. reduce stress. Start saving!
Nail Clippers,Personal Care,Precision stainless steel set,Limited time! Get Nail Clippers now. Precision stainless steel set. maximize results. Don't wait before it's gone!
Yoga Blocks,Sports & Fitness,Supportive props for proper alignment,Don't miss out on Yoga Blocks. Supportive props for proper alignment. simplify life. Upgrade now - stock is limited!
Stapler,Office Supplies,Heavy-duty metal construction,Get save time and eliminate hassle with our Stapler. Heavy-duty metal construction. Make the switch now!
Spice Rack,Home & Kitchen,Organize all spices with rotating stand,Limited time! Get Spice Rack now. Organize all spices with rotating stand. enhance performance. Try it before it's gone!
Pens,Office Supplies,Smooth-writing ballpoint pens,Say goodbye to limited features. Pens Smooth-writing ballpoint pens. enhance performance. Experience the difference today!
Tie,Accessories,Silk necktie in classic patterns,"Trusted by 50,000+ customers. Tie Silk necktie in classic patterns. Experience the difference today!"
Blender,Home & Kitchen,Powerful motor for smooth smoothies and shakes,"Blender: Rated 5 stars by 50,000+ users. Powerful motor for smooth smoothies and shakes. improve quality. Get yours now!"
Coffee Maker,Home & Kitchen,Programmable machine that brews perfect coffee,"Join 150,000+ happy customers! Coffee Maker - Programmable machine that brews perfect coffee. enhance performance. Start saving!"
Shampoo,Personal Care,Sulfate-free for healthy hair,Say goodbye to frequent breakdowns. Shampoo Sulfate-free for healthy hair. maximize results. Shop now today!
Hair Dryer,Personal Care,Ionic technology for shinier hair,"Hair Dryer: Rated 5 stars by 10,000+ users. Ionic technology for shinier hair. eliminate hassle. Order now now!"
Sticky Notes,Office Supplies,Adhesive notes in assorted sizes,"Packed with premium quality, easy setup, and more. Sticky Notes Adhesive notes in assorted sizes. Don't wait today!"
Exercise Ball,Sports & Fitness,Stability ball for core workouts,"Trusted by 25,000+ customers. Exercise Ball Stability ball for core workouts. Start saving today!"
Dash Cam,Electronics,HD car camera with loop recording and night vision,Dash Cam includes premium quality and easy setup. HD car camera with loop recording and night vision. Upgrade now now!
Kitchen Scale,Home & Kitchen,Digital precision for perfect recipes,Tired of wasted time? Kitchen Scale is your solution! Digital precision for perfect recipes. save time. Shop now!
Can Opener,Home & Kitchen,Smooth-edge safe opener,"Join 50,000+ happy customers! Can Opener - Smooth-edge safe opener. simplify life. Order now!"
T-Shirt,Clothing,100% organic cotton in multiple colors,Don't miss out on T-Shirt. 100% organic cotton in multiple colors. increase comfort. Don't wait - stock is limited!
Balance Board,Sports & Fitness,Wooden board for stability training,Balance Board includes premium quality and easy setup. Wooden board for stability training. Don't wait now!
Yoga Blocks,Sports & Fitness,Supportive props for proper alignment,"Trusted by 100,000+ customers. Yoga Blocks Supportive props for proper alignment. Start saving today!"
Ankle Weights,Sports & Fitness,Adjustable weights for leg exercises,Tired of uncomfortable use? Ankle Weights is your solution! Adjustable weights for leg exercises. eliminate hassle. Upgrade now!
Yoga Blocks,Sports & Fitness,Supportive props for proper alignment,"Yoga Blocks: Rated 5 stars by 25,000+ users. Supportive props for proper alignment. maximize results. Upgrade now now!"
Desk Organizer,Office Supplies,Bamboo organizer with compartments,"Trusted by 25,000+ customers. Desk Organizer Bamboo organizer with compartments. Make the switch today!"
Razor,Personal Care,Multi-blade for smooth shave,"Trusted by 50,000+ customers. Razor Multi-blade for smooth shave. Shop now today!"
Boxing Gloves,Sports & Fitness,Padded gloves for training,Struggling with uncomfortable use? Our Boxing Gloves changes everything. Padded gloves for training. Don't wait!
Backpack,Accessories,Waterproof with laptop compartment,"Join 50,000+ happy customers! Backpack - Waterproof with laptop compartment. maximize results. Don't wait!"
Smart Light Bulbs,Electronics,WiFi-enabled color-changing LED bulbs,Struggling with unreliable performance? Our Smart Light Bulbs changes everything. WiFi-enabled color-changing LED bulbs. Start saving!
Kitchen Scale,Home & Kitchen,Digital precision for perfect recipes,"Packed with premium quality, easy setup, and more. Kitchen Scale Digital precision for perfect recipes. Upgrade now today!"
Yoga Strap,Sports & Fitness,Improve flexibility and reach,Don't miss out on Yoga Strap. Improve flexibility and reach. simplify life. Shop now - stock is limited!
Moisturizer,Personal Care,Hydrating cream with SPF protection,Get improve quality and maximize results with our Moisturizer. Hydrating cream with SPF protection. Buy today now!
Conditioner,Personal Care,Deep conditioning treatment,Conditioner delivers eliminate hassle and save time. Deep conditioning treatment. Perfect for students. Experience the difference!
Backpack,Accessories,Waterproof with laptop compartment,"Packed with premium quality, easy setup, and more. Backpack Waterproof with laptop compartment. Experience the difference today!"
Ring Light,Electronics,Adjustable brightness for perfect lighting,Get enhance performance and save time with our Ring Light. Adjustable brightness for perfect lighting. Start saving now!
USB-C Hub,Electronics,Multi-port adapter with HDMI and USB 3.0,Don't miss out on USB-C Hub. Multi-port adapter with HDMI and USB 3.0. save time. Order now - stock is limited!
Wine Opener,Home & Kitchen,Electric corkscrew for effortless opening,Wine Opener delivers reduce stress and save time. Electric corkscrew for effortless opening. Perfect for remote workers. Start saving!
Scarf,Accessories,Soft cashmere blend,"Trusted by 50,000+ customers. Scarf Soft cashmere blend. Make the switch today!"
Trash Bags,Home & Kitchen,Heavy-duty leak-proof bags,Trash Bags includes premium quality and easy setup. Heavy-duty leak-proof bags. Get yours now!
Electric Toothbrush,Personal Care,Sonic cleaning with smart timer,Struggling with unreliable performance? Our Electric Toothbrush changes everything. Sonic cleaning with smart timer. Make the switch!
Desk Organizer,Office Supplies,Bamboo organizer with compartments,Don't miss out on Desk Organizer. Bamboo organizer with compartments. save money. Start saving - stock is limited!
